speaker,topic,episode_id,episode_name,episode_subdivision,text
1,uncategorized,uncategorized,uncategorized,uncategorized,I-- I think that you can-- you can talk about Islamists who-- clearly are also jihadists. But I think it's-- it-- it's not particularly helpful to make the case that-- Senator Sanders was just making that I agree with that we've gotta reach out to Muslim countries. We've gotta have them be part of our coalition.
1,uncategorized,uncategorized,uncategorized,uncategorized,"If they hear people running for-- president who basically shortcut it to say we are somehow against Islam-- that was one of the real contributions-- despite all the other problems that George W. Bush made after 9/11 when he basically said after going to a mosque in Washington, ""We are not at war with Islam or Muslims. We are at war with violent extremism. We are at war with people who use their religion for purposes of power and oppression."" And yes, we are at war with those people but I don't want us to be painting with too broad a brush."
1,uncategorized,uncategorized,uncategorized,uncategorized,(OVERTALK)
2,uncategorized,uncategorized,uncategorized,uncategorized,The reason I ask is that you gave a speech at Georgetown University in which you said that it was important to show-- quote-- respect even for one's enemy. Trying to understand and in so far as psychologically possible empathize with their perspective and point of view. Can you explain what that means in the context of this kind of barbarism?
1,uncategorized,uncategorized,uncategorized,uncategorized,"I think with this kind of barbarism and nihilism-- it's very hard to understand other than the lust for power, the rejection of (unintel), the total disregard for human life-- freedom or any other value that we know and-- respect."
1,uncategorized,uncategorized,uncategorized,uncategorized,"Historically it is important to try to understand your adversary in order to figure out how they are thinking, what they will be doing, how they will react. I-- I plead -- that it's very difficult when you deal with-- ISIS and organizations like that whose-- whose behavior is so barbaric and so vicious-- that it doesn't seem to have any purpose other than lust for killing and power. And that's very difficult to put ourselves in other shoes."
1,uncategorized,uncategorized,uncategorized,uncategorized,(OVERTALK)
2,uncategorized,uncategorized,uncategorized,uncategorized,"Very quickly, do either of you-- radical Islam, do either of you use that--"
2,uncategorized,uncategorized,uncategorized,uncategorized,(OVERTALK)
2,uncategorized,uncategorized,uncategorized,uncategorized,phrase?
3,uncategorized,uncategorized,uncategorized,uncategorized,"I don't think the term is what's important. What is important to understand is we have organizations, whether it is ISIS or Al Qaeda who do believe we should go back several thousand years, we should make women third-class citizens, that we should allow children to be sexually assaulted, that they are a danger to modern society. And that this world with American leadership can and must come together to destroy them. We can do that."
4,uncategorized,uncategorized,uncategorized,uncategorized,John--
3,uncategorized,uncategorized,uncategorized,uncategorized,"And it requires an entire world to come together including, in a very active way, the Muslim nations."
2,uncategorized,uncategorized,uncategorized,uncategorized,"Governor O'Malley, you've been making the case-- when you talk about lack of forward vision, you're essentially been saying that Secretary Clinton lacks that vision. And this critique matches up with this discussion of language. The critique is that the softness of language betrays a softness of approach. So if this language-- if you don't call it by what it is, how can your approach be effective to the cause. That's the critique."
4,uncategorized,uncategorized,uncategorized,uncategorized,"I believe calling it what it is, is to say radical jihadis, that's to call what it is. But John, let's not fall into the trap of thinking that all of our Muslim-American neighbors in this country are somehow our enemies here. They are our first line of defense."
4,uncategorized,uncategorized,uncategorized,uncategorized,And we are going to be able to defeat ISIS on the ground there as well as in this world-- because of the Muslim-Americans in our country and throughout the world who understand that this brutal and barbaric group is perverting the name of a great world religion. And now like we never before-- we need our Muslim-American neighbors to stand up and to-- and to be a part of this.
2,uncategorized,uncategorized,uncategorized,uncategorized,"Secretary Clinton, the-- French president has called this attack an act of war. A couple of days ago you were asked if you would declare war on ISIS and you said no. Would you-- would you-- what would you say now?"
1,uncategorized,uncategorized,uncategorized,uncategorized,"Well, we-- we have an authorization to use military force against terrorists. We-- passed it after 9/11."
2,uncategorized,uncategorized,uncategorized,uncategorized,And you think that covers all of it?
1,uncategorized,uncategorized,uncategorized,uncategorized,It-- it certainly does cover it. I-- I would like to see it updated.
2,uncategorized,uncategorized,uncategorized,uncategorized,If you were in the Senate-- if you were in the Senate would you be okay with-- the commander in chief doing that without coming back to you?
1,uncategorized,uncategorized,uncategorized,uncategorized,"No. It would have to go through the Congress. And I know the White House has actually been working with members of Congress. Maybe now we can get it moving again so that we can upgrade it so that it does include all the tools and everything in our arsenal that we can use to try to work with our allies and our friends, come up with better intelligence."
1,uncategorized,uncategorized,uncategorized,uncategorized,"You know, it is difficult finding intelligence that is actionable in a lot of these places. But we have to keep trying. And we have to do more to prevent the flood of foreign fighters who have gone to Syria, especially the ones with-- with western passports that come back. So there's a lot of work we need to do. And I wanna be sure that what's called the AUMF has the authority that is needed going forward."
1,uncategorized,uncategorized,uncategorized,uncategorized,(OVERTALK)
2,uncategorized,uncategorized,uncategorized,uncategorized,Let me just-- let that is-- whatever you've got to say refugees. You've been a little vague about what you've done in the Syrian refugees.
2,uncategorized,uncategorized,uncategorized,uncategorized,(OVERTALK)
2,uncategorized,uncategorized,uncategorized,uncategorized,"I mean, what's your view on them now--"
3,uncategorized,uncategorized,uncategorized,uncategorized,Let me pick up an issue that-- a very important issue that we have not yet discussed. This nation is the most powerful military in the world. We're spending over $600 billion a year on the military. And yet significantly less than 10% of that money is used to be fighting international terrorism.
3,uncategorized,uncategorized,uncategorized,uncategorized,"We are spending hundreds of billions of dollars maintaining 5,000 nuclear weapons. I think we need major reform in the military making it more cost effective but also focusing on the real crisis that faces us. The Cold War is over and our focus has got to be on intelligence, increased manpower, fighting international terrorism."
3,uncategorized,uncategorized,uncategorized,uncategorized,"In terms of refugees I believe that the United States has the moral responsibility with Europe, with Gulf countries like Saudi Arabia to make sure that when people leave countries like Afghanistan and Syria with nothing more than the clothing on their back that of course we reach out. Now what the magic number is, I don't know. Because we don't know the extent of the problem. But I certainly think that the United States should take its full responsibility in helping those."
2,uncategorized,uncategorized,uncategorized,uncategorized,"Governor O'Malley, you have a magic number. I think it's 65,000. Does that number go up or down based on what happened yesterday?"
4,uncategorized,uncategorized,uncategorized,uncategorized,"John, I was the first person on this stage to say that we should accept the 65,000 Syrian refugees that were s-- were fleeing the sort of murder of-- of ISIL. And I believe that that needs to be done with proper screening. But accommodating 65,000 refugees in our country today, people of 320 million is akin to making room for six and a half more people in a baseball stadium with 32,000."
4,uncategorized,uncategorized,uncategorized,uncategorized,"There are other ways to lead and to be a moral leader in this world rather than at the opposite end of a drone strike. But I would want to agree with something that Senator Sanders says, the nature of warfare has changed. This is not a conflict where we send in the third divisions of marines. This is-- a new era of conflict where traditional ways of-- of huge standing armies are not as-- serve our purposes as well as special ops, better intelligence and being more proactive."
2,uncategorized,uncategorized,uncategorized,uncategorized,"Just very quickly, 65,000, the number stays?"
4,uncategorized,uncategorized,uncategorized,uncategorized,That's what I understand is the request from the international--
4,uncategorized,uncategorized,uncategorized,uncategorized,(OVERTALK)
2,uncategorized,uncategorized,uncategorized,uncategorized,But-- what would you want?
4,uncategorized,uncategorized,uncategorized,uncategorized,I would want us to take our place among the nations of the world to alleviate the sorta death and the-- the-- the specter we saw--
4,uncategorized,uncategorized,uncategorized,uncategorized,(OVERTALK)
4,uncategorized,uncategorized,uncategorized,uncategorized,"--little kids, fathers walking up on a beach."
2,uncategorized,uncategorized,uncategorized,uncategorized,"Secretary Clinton, let me ask you a question from Twitter that's come in. And this is a question on this issue of-- of refugees. The question is with the U.S. preparing to absorb Syrian refugees, how do you propose we screen those coming in to keep our citizens safe?"
1,uncategorized,uncategorized,uncategorized,uncategorized,I think that is the number one requirement. I also said that we should take-- increased numbers of refugees. The administration originally said ten. I said we should go to 65 but only if we have as carefully screening and vetting process as we can imagine whatever resources it takes.
1,uncategorized,uncategorized,uncategorized,uncategorized,"Because I do not want us to-- in any way-- inadvertently allow people who wish us harm to come into our country. But I wanna say a quick word about what-- Senator Sanders and-- and then O-- and Governor O'Malley said. We do have to take a hard look at the defense budget. And we do have to figure out how we get ready to fight the adversaries of the future, not the past. But we have to also be very clear that we do have some continuing challenges. We got challenges in the South China Sea because of what China is doing in building up-- these-- military installations."
1,uncategorized,uncategorized,uncategorized,uncategorized,We have problems with Russia. Just the other day Russia allowed a-- television camera to see the plans for a drone submarine that could carry a tactical nuclear weapon. So we've gotta look at the full range and then come to some smart decisions about have-- having more streamlined and focused--
1,uncategorized,uncategorized,uncategorized,uncategorized,(OVERTALK)
2,uncategorized,uncategorized,uncategorized,uncategorized,"Senator Sanders, I'm sorry, we're gonna have to take a break now. We will have more of the Democratic debate here from Drake University in Des Moines, (APPLAUSE) Iowa."
2,uncategorized,uncategorized,uncategorized,uncategorized,[COMMERCIAL BREAK]
2,uncategorized,uncategorized,uncategorized,uncategorized,"Wanna turn now from terrorism to another important issue for many Americans, the financial squeeze on the middle class. For that, we go to my CBS News colleague, Nancy Cordes. Nancy?"
2,uncategorized,uncategorized,uncategorized,uncategorized,"John, thanks so much. We've learned a lot during the course of this campaign about the things that you'd like to do-- that you think help the middle class. So we haven't learned quite as much about who would pick up the tab. So Secretary Clinton, first to you, you want to cap individual subscription drug costs at $250 a month. You want to make c-- public college debt free. You want community college to be free altogether and you want mandatory paid family leave. So who pays for all of that? Is it employers? Is it the taxpayers? And which taxpayers?"
1,uncategorized,uncategorized,uncategorized,uncategorized,"Well, first of all, it isn't the middle class. I have made very clear that-- hard-working, middle class families need a raise, not a tax increase. In fact-- wages adjusted for inflation haven't risen since-- the turn of the last century after my husband's administration. So we have a lot of work to do to get jobs going again, get incomes rising again."
1,uncategorized,uncategorized,uncategorized,uncategorized,"And I have laid out specific plans. You can go to my website, HillaryClinton.com and read the details. And I will pay for it by, yes, taxing the wealthy more, closing corporate loopholes, deductions and other kinds of favorable treatment. And I can do it without raising the debt, without raising taxes on the middle class and making it reasonably-- manageable within our budget so that we can be fiscally responsible at the same time."
2,uncategorized,uncategorized,uncategorized,uncategorized,But a quick follow-up on that $250 a month a cap. Wouldn't the pharmaceutical companies and insurance companies just pass that cost onto the consumers in the form of higher premiums?
1,uncategorized,uncategorized,uncategorized,uncategorized,"Well, we're gonna have to redo the way the prescription drug-- industry does business. For example, it is outrageous that we don't have an opportunity for Medicare to negotiate for lower prices. In fact, American-- consumers pay the highest prices in the world for drugs that we helped to be developed through the National Institutes of Health and that we then tested through the FDA. So there's more to my plan than just the cap. We have to go after price gouging and monopolistic practices and get Medicare the authority to negotiate."
2,uncategorized,uncategorized,uncategorized,uncategorized,"Governor O'Malley, you also want to make public college debt free, you want to--"
4,uncategorized,uncategorized,uncategorized,uncategorized,That's right.
4,uncategorized,uncategorized,uncategorized,uncategorized,(OVERTALK)
2,uncategorized,uncategorized,uncategorized,uncategorized,"--tuition. You've got your own family leave plan. How would you pay for it? In Maryland you raised the sales tax, you raised the gas tax and you raised taxes on families making over $150,000 a year. Is that the blueprint?"
4,uncategorized,uncategorized,uncategorized,uncategorized,"Nancy, the blueprint in Maryland that we follow was, yes, we did, in fact, raise the-- the sales tax by a penny. And we made our public schools the best public schools in America for five years in a row with that investment. And, yes, we did ask everyone the-- the top 14% of earners in our state to pay more in their income tax."
4,uncategorized,uncategorized,uncategorized,uncategorized,"And we were the only state to go four years without a penny's increase to college tuition. So while other candidates will talk about the things they would like to do, I actually got these things in a state that defended not only a triple A bond rating but the highest medium income in America."
4,uncategorized,uncategorized,uncategorized,uncategorized,"I believe that we paid for many of the things that we need to do again as a nation, investing in the skills of our people, our infrastructure and research and development and also climate change-- by the elimination of one big entitlement that we can no longer afford as a people. And that is the entitlement that many of our super wealthiest citizens feel they are entitled to pay, namely a much lower income tax rate and a lower tax rate on capital gains. I believe capital gains for the most part should be taxed the same way we tax incomes from hard work, sweat and toil. And if we do those things we can be-- a country that actually can afford debt-free college again."
2,uncategorized,uncategorized,uncategorized,uncategorized,"Senator Sanders, you want to make public college free altogether. You want to increase social security benefits. And you want to spend--spend a $1 trillion on infrastructure. So you said that to do some of these things you'll impose a tax on top earners. How high would their rate go in a Sanders administration?"
3,uncategorized,uncategorized,uncategorized,uncategorized,Let me put those proposals-- and you're absolutely right. That is what I wanna do. That is what has to happen if we're gonna revitalize and rebuild the crumbling middle class. In the last 30 years there has been a massive redistribution of wealth. And I know that term gets my Republican friends nervous.
3,uncategorized,uncategorized,uncategorized,uncategorized,"The problem is this redistribution has gone in the wrong direction. Trillions of dollars have gone to the middle class and working families to the top 1/10 of 1% who have doubled the percentage of wealth they now own. Yes, I do believe that we must end corporate loopholes such that major corporations year after year pay virtually zero in federal income tax because they're stashing their money in the Cayman Islands."
3,uncategorized,uncategorized,uncategorized,uncategorized,"Yes, I do believe there must be a tax on Wall Street speculation. We bailed out Wall Street. It is their time to bail out the middle class. Help our kids be able to go to college tuition free. So we pay for this by do demanding that the wealthiest people and the largest corporation who have gotten away with murder for years pay their share."
2,uncategorized,uncategorized,uncategorized,uncategorized,"Well, let's get specific, how high would you go? You said before you'd go above 50%. How high?"
3,uncategorized,uncategorized,uncategorized,uncategorized,We haven't come up with an exact number yet. But it will not be as high as the number under Dwight D. Eisenhower which was 90%. But it will be-- (LAUGHTER)
3,uncategorized,uncategorized,uncategorized,uncategorized,(OVERTALK)
3,uncategorized,uncategorized,uncategorized,uncategorized,I'm not a socialist compared to Eisenhower. (LAUGHTER) But-- (CHEERING) but-- but we are gonna end the absurdity as Warren Buffet often reminds us--
4,uncategorized,uncategorized,uncategorized,uncategorized,That's right.
3,uncategorized,uncategorized,uncategorized,uncategorized,--that billionaires pay an effective tax rate lower than nurses or truck drivers. That makes no sense at all. There has to be real tax reform and the wealthiest and large corporations will pay when I'm president.
4,uncategorized,uncategorized,uncategorized,uncategorized,"I mean, under Ronald Raegan's first term the highest marginal rate was 70%. And in talking to a lot of our neighbors who are in that super wealthy millionaire and billionaire category great numbers of them love their country enough to do more again in order to create more opportunity for America's middle class."
2,uncategorized,uncategorized,uncategorized,uncategorized,"Secretary Clinton, Americans say that health care costs and wages are their top financial concerns. And health care deductibles alone have risen 67% over the past five years. Is this something that Obamacare was designed to address? And if not, why not?"
1,uncategorized,uncategorized,uncategorized,uncategorized,"Well, look, I believe that we've made great progress as a country with the Affordable Care Act. We've been struggling to get this done since Harry Truman. And it was not only a great accomplishment of the Democratic Party but of President Obama."
1,uncategorized,uncategorized,uncategorized,uncategorized,"I do think that it's important to defend it. The Republicans have voted to repeal it nearly 60 times. They would like to rip it up and start all over again, throw our nation back into this really contentious debate that we've had about health care for quite some time now."
1,uncategorized,uncategorized,uncategorized,uncategorized,"I wanna build on and improve the Affordable Care Act. I would certainly tackle the cost issues because I think that once the foundation was laid with a system to try to get as many people as possible into it, to end insurance discrimination against people with pre-existing conditions or women, for example, that, yes, we were gonna have to figure out how to get more competition in the insurance market, how to get the cost of particularly prescription drugs but other out of pocket expenses down."
1,uncategorized,uncategorized,uncategorized,uncategorized,But I think it's important to understand there's a significant difference that I have with Senator Sanders about how best to provide quality affordable health care for everyone. And it's-- it's a worthy debate. It's an important one that we should--
2,uncategorized,uncategorized,uncategorized,uncategorized,It is--
1,uncategorized,uncategorized,uncategorized,uncategorized,--be engaged in.
2,uncategorized,uncategorized,uncategorized,uncategorized,"--it is a worthy debate. Senator Sanders, a quick response and then we'll get-- into health care again later."
3,uncategorized,uncategorized,uncategorized,uncategorized,I am on the committee that helped write the Affordable Care Act. We have made some good progress. Now what we have to take on is the pharmaceutical industry that is ripping off the American people every single day. I am proud that I was the first member of Congress to take Americans over the Canadian border to buy breast cancer drugs for 1/10 the price they were paying in the United States.
3,uncategorized,uncategorized,uncategorized,uncategorized,"But at the end of the day no doubt the Affordable Care Act is a step forward. I think we all support it. I believe we've gotta go further. I wanna end the international embarrassment of the United States of America being the only major country on earth that doesn't guarantee health care to all people as a right, not a privilege."
3,uncategorized,uncategorized,uncategorized,uncategorized,(CHEERING) Also-- also what we should be clear about is we end up spending-- I think the secretary knows this-- far more per capita on health care than any other major country and our outcomes-- health care outcomes are not necessarily--
4,uncategorized,uncategorized,uncategorized,uncategorized,"All right, Nancy, I really--"
4,uncategorized,uncategorized,uncategorized,uncategorized,(OVERTALK)
4,uncategorized,uncategorized,uncategorized,uncategorized,--particularly found a way to reduce--
2,uncategorized,uncategorized,uncategorized,uncategorized,Governor.
4,uncategorized,uncategorized,uncategorized,uncategorized,--hospital costs. So whenever we--
2,uncategorized,uncategorized,uncategorized,uncategorized,"Governor, you're breaking the rules."
2,uncategorized,uncategorized,uncategorized,uncategorized,(OVERTALK)
2,uncategorized,uncategorized,uncategorized,uncategorized,"I'm sorry, we're gonna have to cut for a commercial. We'll be right back here from Drake University in Des Moines, Iowa."
4,uncategorized,uncategorized,uncategorized,uncategorized,Thank you. (APPLAUSE)
4,uncategorized,uncategorized,uncategorized,uncategorized,(COMMERCIAL BREAK)
2,uncategorized,uncategorized,uncategorized,uncategorized,"There's a lot of presidential history here in Iowa. It holds the first in the nation Caucasus. Herbert Hoover was born in West Branch. And tonight we're in Pope County for our 11th president with three people who hope to be number 45. Joining me now to question them are Iowan Keven Cooney of KCCI and Kathie Obradovich of the Des Moines Register, Kevin."
2,uncategorized,uncategorized,uncategorized,uncategorized,"Thanks John. Candidates, we've already-- heard your answers on what you would do with Syrian refugees. But a crucial part of the immigration debate here at home controlling our own borders. Republican say the borders, security borders is a top priority. Democrats say they wanna plan for comprehensive integration reform. So Governor O'Malley, are you willing to compromise on this particular issue to focus on border security first if they were keeping the country safe?"
4,uncategorized,uncategorized,uncategorized,uncategorized,"Well, security-- we've actually been focusing on do-- border security to the exclusion of talking about comprehensive immigration reform. In fact if more border security and the-- and more and more deportations we're going to bring our republican brothers and sisters to the table it would've happened long ago. The fact of the matter is-- and let's say it in our debate because you'll never hear this from that-- immigrant bashing carnival barker Donald Trump, (LAUGH) the truth of the matter is-- (APPLAUSE) the truth of the matter is net immigration from Mexico last year was zero. Fact check me, go ahead, check it out. But the truth of the matter is if we want wages to go up we've got to get 11 million of our neighbors out of the off the books shadow economy and into the full light of an American economy."
