speaker,topic,episode_id,episode_name,episode_subdivision,text
1,uncategorized,uncategorized,uncategorized,uncategorized,And 85 percent of gun owners agree. We've got the consensus. What we're lacking is political leadership. And that's what you and others can start providing in the senate. (APPLAUSE)
3,uncategorized,uncategorized,uncategorized,uncategorized,"Yes, I agree."
2,uncategorized,uncategorized,uncategorized,uncategorized,"Sorry, I'm gonna bring in Nancy Cordes with a question from Twitter about this exchange."
2,uncategorized,uncategorized,uncategorized,uncategorized,"There was a lot of conversation on Twitter about guns but also about your conversation on campaign finance. And Secretary Clinton, one of the tweets we saw-- said that I've never seen a candidate invoke 9/11 to justify millions of Wall Street donations until now the idea being that, yes, you are a champion of the community after 9/11. But what does that have to do with taking big donations?"
1,uncategorized,uncategorized,uncategorized,uncategorized,"Well, I'm sorry that whoever tweeted that-- had that impression because I worked closely with New Yorkers after 9/11 for my entire first term to rebuild. And so yes, I did know people. I had a lot of folks give me donations from all kinds of backgrounds, say, ""I don't agree with you on everything. But I like what you do. I like how you stand up. I'm going to support you."" (LAUGH) And I think that is absolutely perfect."
3,uncategorized,uncategorized,uncategorized,uncategorized,"Well, I-- if I might-- I-- I-- I think the issue here is that I--and I applaud Secretary Clinton. She did. She was the senator from New York. She worked-- many of us supported you in trying to rebuild that devastation. But at the end of the day Wall Street today has an enormous economic and political power. Their business model is greed and fraud. And for the sake of our economy they must-- the major banks must be broken up."
1,uncategorized,uncategorized,uncategorized,uncategorized,But--
4,uncategorized,uncategorized,uncategorized,uncategorized,"John, I think somewhere between the--"
4,uncategorized,uncategorized,uncategorized,uncategorized,(OVERTALK)
2,uncategorized,uncategorized,uncategorized,uncategorized,"Senator Sanders, but what is it in Secretary Clinton's record-- that shows you that she's been influenced by those donations?"
3,uncategorized,uncategorized,uncategorized,uncategorized,"Well, there--"
3,uncategorized,uncategorized,uncategorized,uncategorized,(OVERTALK)
3,uncategorized,uncategorized,uncategorized,uncategorized,The issue right now is whether or not we reestablish Glass Steagall. I led the effort unfortunately unsuccessfully against deregulation because I knew when you merge large insurance companies and investment banks and commercial banks it was not going to be good. The issue now is do we break them up? Do we reestablish Glass Steagall? And Secretary Clinton unfortunately is on the wrong side.
1,uncategorized,uncategorized,uncategorized,uncategorized,"Well, I'll tell you who's on my side, Paul Krugman, the Nobel prize winning economist who said my plan for what we should do to reign in Wall Street was more comprehensive and better. Paul Volcker, one of the leading lights of trying to reign in the excesses has also said he does not support reinstating Glass Steagall."
1,uncategorized,uncategorized,uncategorized,uncategorized,"So I mean, this may seem like a bit of an arcane discussion. I have nothing against the passion that my two friends here have about reinstating Glass Steagall. I just don't think it would get the job done. I'm all about making sure (APPLAUSE) we actually get results for whatever reason."
2,uncategorized,uncategorized,uncategorized,uncategorized,"That's-- a final word-- the final word, Governor O'Malley, before we go to commercial."
4,uncategorized,uncategorized,uncategorized,uncategorized,"John, there is not-- a serious economist who would disagree that the six big banks of Wall Street have taken on so much power and that all of us are still on the hook to bail them out on their bad debts. That's not capitalism, Secretary Clinton-- Clinton, that's crummy capitalism."
4,uncategorized,uncategorized,uncategorized,uncategorized,"That's a wonderful business model if you place bad bets-- the taxpayers bail you out. But if you place good ones you pocket it. Look, I don't believe that the model-- there's lots of good people that work in finance, Secretary Sanders. But Secretary Clinton, we need to step up. And we need to protect main street from Wall Street. And you can't do that by-- by campaigning as the candidate of Wall Street. I am not the candidate of Wall Street. And I encourage--"
3,uncategorized,uncategorized,uncategorized,uncategorized,Let me--
4,uncategorized,uncategorized,uncategorized,uncategorized,--everybody watching this tonight to-- please-- acknowledge that by going online at MartinO'Malley.com and help me wage this campaign for real American capitalism.
4,uncategorized,uncategorized,uncategorized,uncategorized,(APPLAUSE)
2,uncategorized,uncategorized,uncategorized,uncategorized,"We have to-- we have to go for a commercial Senator, I'm sorry. We have to go for a commercial here. We'll be right back with the democratic debate here in Des Moines, Iowa on CBS."
2,uncategorized,uncategorized,uncategorized,uncategorized,(THEME MUSIC)
2,uncategorized,uncategorized,uncategorized,uncategorized,[COMMERCIAL BREAK]
2,uncategorized,uncategorized,uncategorized,uncategorized,"Back now in Des Moines with the candidates for the Democratic presidential nomination. Senator Sanders, I wanna start with you. Let's say you're elected president. Congratulations."
3,uncategorized,uncategorized,uncategorized,uncategorized,Thank you. (LAUGHTER) (CHEERING) Looking forward to it. (APPLAUSE)
2,uncategorized,uncategorized,uncategorized,uncategorized,You've said you'll have a revolution.
3,uncategorized,uncategorized,uncategorized,uncategorized,Yes.
2,uncategorized,uncategorized,uncategorized,uncategorized,"But there's a conservative revolution going on in America right now. As John Boehner knows, and as Democrats know who have lost in state Houses across the country--"
3,uncategorized,uncategorized,uncategorized,uncategorized,Right.
2,uncategorized,uncategorized,uncategorized,uncategorized,"--those conservatives are watching tonight and probably shaking their heads. So (LAUGHTER) how do you deal with that part of the country? The revolution's already happening, but on the other side."
3,uncategorized,uncategorized,uncategorized,uncategorized,"And we are gonna do a political revolution which brings working people, young people, senior citizens, minorities together. Because every issue that I am talking about, paid family and medical leave, breaking up the banks on Wall Street, asking the wealthy to pay their fair share of taxes, rebuilding a fumbling infrastructure, raising the minimum wage to 15 bucks an hour, every one of those issues is supported by a significant majority of the American people."
3,uncategorized,uncategorized,uncategorized,uncategorized,"Problem is, that as a result of a corrupt campaign finance system, Congress is not listening to the American people. It's listening to the big money interest. What the political revolution is about is bringing people together to finally say, ""Enough is enough. This government belongs to us, not just the billionaires."""
2,uncategorized,uncategorized,uncategorized,uncategorized,"Senator, as a 30-second follow-up. We've heard already tonight that-- that your 92% of support for background checks. Let the ar-- let's look at that as-- as an example. There was something 92% of the public was for, there have been these-- these mass shootings, there was emotional support behind it."
3,uncategorized,uncategorized,uncategorized,uncategorized,Yes.
2,uncategorized,uncategorized,uncategorized,uncategorized,Bipartisan support.
3,uncategorized,uncategorized,uncategorized,uncategorized,Yes.
2,uncategorized,uncategorized,uncategorized,uncategorized,"The president, the full force of his office."
3,uncategorized,uncategorized,uncategorized,uncategorized,Yup.
2,uncategorized,uncategorized,uncategorized,uncategorized,It went nowhere. That's the model you're talking about-- nothing happened.
3,uncategorized,uncategorized,uncategorized,uncategorized,"What we need is leadership in this country which revitalizes American democracy. And makes people understand that if they stand up and fight back and take on the bullet-- p-- billionaire class, we can bring about the change that we need. If we are not successful, if we continue the same old same old of Washington being run by corporate lobbyists and big money and trusts, nothing changes."
3,uncategorized,uncategorized,uncategorized,uncategorized,"I am very happy in this campaign that we have had rallies with tens of thousands of people, mostly young people. What the polls are showing is that we are absolutely defeating the secretary among younger people. We're giving young people and working people hope that real change can take place in America. That's what the political revolution is about."
2,uncategorized,uncategorized,uncategorized,uncategorized,A ques-- a question from Kathie Obradovich.
2,uncategorized,uncategorized,uncategorized,uncategorized,"Yes. Senator Sanders, you famously said in the last debate that you were sick and tired of hearing about your damn emails. But then you told The Wall Street Journal that the questions about whether or not Secretary Clinton's emails compromised classified information were valid questions. So what does it mean? Is it an issue or is it not?"
3,uncategorized,uncategorized,uncategorized,uncategorized,"That's just media fluff. I was sick and tired of Hillary Clinton's email. I am still sick and tired of Hillary Clinton's emails. (LAUGHTER) And the issue is-- the problem is the front pages every day were dealing with that. I didn't know I had so much power. But after I said that, without hearing much of that, Hillary (LAUGH) (UNINTEL)."
2,uncategorized,uncategorized,uncategorized,uncategorized,But (UNINTEL) all right--
3,uncategorized,uncategorized,uncategorized,uncategorized,"What I would like for the media now (APPLAUSE) is for us to be talking about why the middle class is disappearing while we have more people in jail than any other country, why we have massive levels of income and wealth inequality and we're the only major country without paid family and medical leave. We've gotten off of Hillary's emails, good. Let's go to the major issues facing America. (CHEERING) (APPLAUSE)"
3,uncategorized,uncategorized,uncategorized,uncategorized,(OVERTALK)
2,uncategorized,uncategorized,uncategorized,uncategorized,--your response.
1,uncategorized,uncategorized,uncategorized,uncategorized,"I'm sorry, I couldn't hear you."
2,uncategorized,uncategorized,uncategorized,uncategorized,"Secretary Clinton, your response?"
1,uncategorized,uncategorized,uncategorized,uncategorized,"I agree completely. (LAUGHTER) (APPLAUSE) I couldn't have said it better myself. But-- but I-- I did wanna-- I-- I wanted to follow up. Look, we need more Americans to be involved in the political process. And I give Senator Sanders a lot of credit for really lighting a fire under many people, young, old, everybody who sees a chance to be involved and have their voice heard."
1,uncategorized,uncategorized,uncategorized,uncategorized,Look at what's happening with the Republicans. They're doing everything they can to prevent the voices of Americans to be heard. (APPLAUSE) They're trying to prevent people from registering to vote. So we do need to take on the Republicans-- very clearly and directly. But the other thing I just wanted quickly to say is I think President Obama deserves more credit than he gets for what he got done-- (APPLAUSE) in Washington despite the Republican oppression.
2,uncategorized,uncategorized,uncategorized,uncategorized,"Secretary Clinton, just one-- more question on the email question. For Democrats, there's an F.B.I. investigation going on. Can you satisfy Democrats who might worry about another shoe dropping? That you and your staff have been totally truthful to them and that another shoe is not gonna drop?"
1,uncategorized,uncategorized,uncategorized,uncategorized,"Well, I think after 11 hours that's pretty clear. Yeah. (LAUGHTER) (CHEERING) (APPLAUSE) You know, I-- I do think it's important to do exactly what Senator Sanders said. And that is to start talking about the issues that the American people really care about and that they talk to each of us about and to contrast."
1,uncategorized,uncategorized,uncategorized,uncategorized,"I mean, there are differences among us. You've heard some of those tonight. I still wanna get back to healthcare, because I think that's a worthy topic to explore. But the differences among us pale compared to what's happening on the Republican--"
2,uncategorized,uncategorized,uncategorized,uncategorized,What--
1,uncategorized,uncategorized,uncategorized,uncategorized,"--side. And if you listen to what they say, and I had a chance over those 11 hours to watch and listen as well as what I see in their debate, they are putting forth alarming plans. I mean, all of us support funding Planned Parenthood. All of us believe climate change is real. All of us want equal pay for equal work. They don't believe in any of that. So let's focus on what this election is really gonna be about. (APPLAUSE)"
2,uncategorized,uncategorized,uncategorized,uncategorized,"Another-- well, race relations is another issue everyone cares about. And we're gonna switch to that now. Governor O'Malley, let me ask you a question. The-- the head of the F.B.I. recently said, ""It might be possible that some police forces are not enforcing the law because they're worried about being caught on camera."" The acting head of the Drug Enforcement Administration said a similar thing. Where-- where are you on this question and what would you do if you were president and two top members of your administration were floating that idea?"
4,uncategorized,uncategorized,uncategorized,uncategorized,"Well, look-- John, I think the-- I think the call of your question is how can we improve both public safety in America and race relations in America understanding how very intertwined both of those issues are in a very, very difficult and painful way for us as a people. Look, the truth of the matter is that we should all feel a sense of responsibility as Americans to look for the things that actually work to save and redeem lives and to do more of them."
4,uncategorized,uncategorized,uncategorized,uncategorized,"And to stop doing the things that don't. From my part, that's what I have done in 15 years of experiences in there and as the governor, we restored voting rights to 52,000 people, we decriminalized possession of small amounts of americ-- of marijuana. I repealed the death penalty, and we also put in place a civilian review board. We reported openly discourtesy and-- and lethal force and brutality complaints."
4,uncategorized,uncategorized,uncategorized,uncategorized,"This is something that-- and I put forward a new agen-- agenda for criminal justice reform that is informed by that experience. So as president, I would lead these efforts and I would do so with more experience and probably the attendance of more gravesites than any of the three of us on this stage when it comes to urban-- crime, loss of lives. And-- the truth is-- I have learned on a very daily basis that yes indeed, black lives matter."
2,uncategorized,uncategorized,uncategorized,uncategorized,"All right, governor. Sen-- (APPLAUSE) se-- Senator Sanders, one of your former colleagues, an African American member of Congress said to me recently that a young African American man had asked him where to find hope in life. And he said, ""I just don't know what to tell him about being young and black in America today."" What would you tell that young African American man?"
3,uncategorized,uncategorized,uncategorized,uncategorized,"Well, this is what I would say. And the congressman was right-- according to the statistics that I'm familiar with, a black male maybe born today stands a one in four chance of ending up in the criminal justice system. Fifty-one percent of high school African American graduates are unemployed or underemployed. We have more people in jail today than any other country on earth."
3,uncategorized,uncategorized,uncategorized,uncategorized,"We're spending $80 billion locking people up disproportionately, Latino and African American. We need very clearly major, major reform in a broken criminal justice system from top to bottom. And that means when police officers out in a community do illegal activity, kill people who are unarmed, who should not be killed, they must be held accountable. It means that we end minimum sentencing for those people (UNINTEL). And it means that we take marijuana out of the federal law as a crime and give states the freedom to go forward with legalizing marijuana."
2,uncategorized,uncategorized,uncategorized,uncategorized,"Secretary-- Clinton, you told some Black Lives Matter activists recently that there's a difference between rhetoric and activism and what you were trying to do, which is-- was enforce law-- or get laws passed that would help what they-- were pushing for. But-- recently at the University of Missouri, that activism was very, very effective. So would you suggest that kind of activism take place at other universities across the country?"
1,uncategorized,uncategorized,uncategorized,uncategorized,"Well, John, I come from-- the '60s, a long time ago. There was a lot of activism on campus. Civil rights activism, anti-war activism, women's rights activism. And I do-- appreciate the way young people-- are standing up and speaking out. Obviously, I believe that on a college campus, there should be enough respect so people hear each other."
1,uncategorized,uncategorized,uncategorized,uncategorized,"But what happened-- at the university there, what's happening at other universities, I think reflects the deep sense of, you know, concern, even despair that so many young people, particularly of color have. You know I recently met with a group of mothers who lost their children to-- either-- killings by police or random killings-- in their neighborhoods."
1,uncategorized,uncategorized,uncategorized,uncategorized,"And hearing their stories was so incredibly, profoundly heartbreaking. Each one of them, you know, describe their child, had a picture. You know, the mother of the young man with his friends in the car who was playing loud music and, you know, some older white man pulled out a gun and shot him because they wouldn't turn the radio down."
1,uncategorized,uncategorized,uncategorized,uncategorized,"Or a young woman who had been-- performing at President Obama's second inauguration, coming home-- absolutely stellar young woman, hanging out with her friends in a park, getting shot by a gang member. And of course, I-- I met the mothers of Eric Garner and Tamir Rice and Michael Brown and Trayvon Martin and so many of them who have lost their children."
1,uncategorized,uncategorized,uncategorized,uncategorized,"So your original question is the right question, and it's not just a question for parents and grandparents to answer. It's really a question for all of us to answer. Every single one of our children deserves the chance to live up to his or her god-given potential. And that's what we need to be doing to the best of our ability in our country--"
2,uncategorized,uncategorized,uncategorized,uncategorized,All right. Over to Kevin Cooney. (APPLAUSE)
2,uncategorized,uncategorized,uncategorized,uncategorized,"Senator-- Senator Sanders-- we've heard a lot about this, your offer-- you-- you wanna offer free tuition in public universities and colleges."
3,uncategorized,uncategorized,uncategorized,uncategorized,Yes.
2,uncategorized,uncategorized,uncategorized,uncategorized,"A couple questions about this. Fifty-three percent of those who enroll graduate. First question, isn't this throwing a lot of money away if we're looking at a third of these people are not going to complete college."
3,uncategorized,uncategorized,uncategorized,uncategorized,"No, it's not throwing-- it is an extraordinary investment for this country. In Germany, many other countries do it already. In fact, if you remember, 50, 60 years ago, University of California, City University of New York were virtually tuition-free. Here is the story."
3,uncategorized,uncategorized,uncategorized,uncategorized,"It's not just that college graduates should be $50,000 or $100,000 in debt. More importantly, I want kids in Burlington, Vermont, or Baltimore, Maryland, who are in the sixth grade or the eighth grade who don't have a lot of money, whose parents that-- like my parents, may never have gone to college. You know what I want, Kevin? I want those kids to know that if they study hard, they do their homework, regardless of the income of their families, they will in fact be able to get a college education. Because we're gonna make public colleges and universities tuition-free. This is revolutionary for education in America. It will give hope to millions of young people."
2,uncategorized,uncategorized,uncategorized,uncategorized,"Well, one of the things that you want to do is to have the states pay for about a third of this $70 billion plan, correct?"
3,uncategorized,uncategorized,uncategorized,uncategorized,Yes.
2,uncategorized,uncategorized,uncategorized,uncategorized,There are 16 states that are running budget deficits right now. Where are they expected to come up with--
3,uncategorized,uncategorized,uncategorized,uncategorized,"Well, I think that they're gonna be pretty smart. If I think a lot of states will do the right thing and I think those states that don't will pay a heavy penalty. Bottom line here is, in the year 2015, we should look at a college degree the same we look at a high school degree, 50 or 60 years ago."
3,uncategorized,uncategorized,uncategorized,uncategorized,"If you wanna make it into the middle class, I'm not saying in all cases, we need -- plumbers and we carpenters and electricians. That's for sure. And they should get help as well. But bottom line now is, in America, in the year 2015, any person who has the ability and desire should be able to get an education, college education, regardless of the income of his or his family. And we must substantially lower, as my legislation does, interest rates on student debt."
2,uncategorized,uncategorized,uncategorized,uncategorized,"Governor O'Malley, jump in, yeah."
4,uncategorized,uncategorized,uncategorized,uncategorized,"Okay, thank you. I have thought that-- (APPLAUSE) I would agree with much of what Senator Sanders says, Kevin. I-- I believe that actually affordable college, debt-free college is the goal that we need to attain as a nation. And-- unlike my three distinguished colleagues on this stage, I actually-- made college more affordable and was the only state that went four years in a row without a penny's increase to college tuition."
4,uncategorized,uncategorized,uncategorized,uncategorized,"I respectfully disagree with Senator Sanders' approach. I believe that the goal should be debt-free college. I believe that our federal government needs to do more on Pell grants, states need to stop cutting higher education, and we should create a new block grant program that keeps the states in-- in the game, and we should lower these outrageous interest rates that parents and kids are being charged by their own government, 7% and 8% to go to college?"
4,uncategorized,uncategorized,uncategorized,uncategorized,"I mean, my dad went to c-- college on the GI bill after comin' home from Japan, flying 33 missions. My daughters went to college on a mountain of bills. But we were proud of them on graduation day. But we're going to be proud every month for the rest of our natural lives. (LAUGHTER) It-- it doesn't need to be that way. We can (APPLAUSE) have debt-free college in the United States."
1,uncategorized,uncategorized,uncategorized,uncategorized,"Governor, if I could just jump in. I-- I believe that we should make community college free. We should have debt-free college if you go to a public college or university. You should not have to borrow a dime to pay tuition. I wanna use Pell grants to help defray-- the living expenses that often-- make a difference whether a young person can stay in school or not."
1,uncategorized,uncategorized,uncategorized,uncategorized,"I disagree with free college for everybody. I don't think taxpayers should be paying to send Donald Trump's kids to college. It think it oughta be a compact, (APPLAUSE) families contribute, kids contribute, and together, we want to make it possible for our new generation of young people to refinance their debt and not come out with debt in the future."
2,uncategorized,uncategorized,uncategorized,uncategorized,"All right, Nancy Cordes has a question."
2,uncategorized,uncategorized,uncategorized,uncategorized,"Back to healthcare by popular demand. First to you, Senator Sanders. You'd prefer to scrap ObamaCare and move to a single-payer system, essentially Medicare for all. You say you wanna put the private insurance companies out of business. Is it realistic to think that you can pull the plug on a $1 trillion industry?"
