index,polarity,subjectivity,timestamp,speaker,speaker_name,text,applause,laughter,interaction,attack,attack_target,agree,agree_target,interruption,interrupt_target,defense,defense_against,reference,mentions,noun_phrases,people,locations,topic,autotopic,first_mention
97,0.2,0.2,,nixon,Nixon,What has happened to you? We find that your wages have gone up five times as much in the Eisenhower Administration as they did in the Truman Administration.,False,False,False,False,[],False,[],False,,False,,False,[],"['eisenhower', 'truman']",[],[],jobs,['misc'],[]
98,0.2,0.2,,nixon,Nixon,What about the prices you pay? We find that the prices you pay went up five times as much in the Truman Administration as they did in the Eisenhower Administration.,False,False,False,False,[],False,[],False,,False,,False,[],"['truman', 'eisenhower']",[],[],jobs,['misc'],[]
99,-0.075,0.19999999999999998,,nixon,Nixon,What's the net result of this? This means that the average family income went up fifteen per cent in the Eisenhower years as against two per cent in the Truman years.,False,False,False,False,[],False,[],False,,False,,False,[],"['net result', 'average family income', 'eisenhower', 'truman']",[],[],jobs,['misc'],[]
100,0.0,0.0,,nixon,Nixon,"Now, this is not standing still.",False,False,False,False,[],False,[],False,,False,,False,[],[],[],[],misc,['misc'],[]
101,0.35,0.55,,nixon,Nixon,"But, good as this record is, may I emphasize it isn't enough.",False,False,False,False,[],False,[],False,,False,,False,[],[],[],[],misc,['misc'],[]
102,0.0,0.0,,nixon,Nixon,A record is never something to stand on.,False,False,False,False,[],False,[],False,,False,,False,[],[],[],[],misc,['misc'],[]
103,0.0,0.0,,nixon,Nixon,It's something to build on.,False,False,False,False,[],False,[],False,,False,,False,[],[],[],[],misc,['misc'],[]
104,-0.4,0.7,,nixon,Nixon,"And in building on this record, I believe that we have the secret for progress, we know the way to progress.",False,False,False,False,[],False,[],False,,False,,False,[],[],[],[],misc,['misc'],[]
105,0.3833333333333333,0.4444444444444444,,nixon,Nixon,"And I think, first of all, our own record proves that we know the way.",False,False,False,False,[],False,[],False,,False,,False,[],['own record proves'],[],[],misc,['misc'],[]
106,0.0,0.0,,nixon,Nixon,Senator Kennedy has suggested that he believes he knows the way.,False,False,True,False,[],False,[],False,,False,,True,['kennedy'],['kennedy'],[],[],kennedy,['misc'],[]
107,0.0,0.0,,nixon,Nixon,I respect the sincerity which he m- which he makes that suggestion.,False,False,False,False,[],False,[],False,,False,,False,[],[],[],[],kennedy,['misc'],[]
108,0.02784090909090909,0.33238636363636365,,nixon,Nixon,"But on the other hand, when we look at the various programs that he offers, they do not seem to be new.",False,False,False,False,[],False,[],False,,False,,False,[],['various programs'],[],[],kennedy,['misc'],[]
109,0.0,0.35714285714285715,,nixon,Nixon,They seem to be simply retreads of the programs of the Truman Administration which preceded it.,False,False,False,False,[],False,[],False,,False,,False,[],['truman'],[],[],misc,['misc'],[]
110,0.10795454545454546,0.5473484848484849,,nixon,Nixon,"And I would suggest that during the course of the evening he might indicate those areas in which his programs are new, where they will mean more progress than we had then.",False,False,False,False,[],False,[],False,,False,,False,[],[],[],[],misc,['misc'],[]
111,0.2125,0.6,,nixon,Nixon,"What kind of programs are we for? We are for programs that will expand educational opportunities, that will give to all Americans their equal chance for education, for all of the things which are necessary and dear to the hearts of our people.",False,False,False,False,[],False,[],False,,False,,False,[],"['educational opportunities', 'equal chance']",[],[],education,['education'],[]
112,0.1,0.225,,nixon,Nixon,"We are for programs, in addition, which will see that our medical care for the aged are - is - are much - is much better handled than it is at the present time.",False,False,False,False,[],False,[],False,,False,,False,[],"['medical care', 'present time']",[],[],healthcare,['misc'],[]
113,0.0,0.0,,nixon,Nixon,"Here again, may I indicate that Senator Kennedy and I are not in disagreement as to the aims.",False,False,True,False,[],False,[],False,,False,,True,['kennedy'],['kennedy'],[],[],kennedy,['misc'],[]
114,0.1,0.2,,nixon,Nixon,We both want to help the old people.,False,False,False,False,[],False,[],False,,False,,False,[],['old people'],[],[],healthcare,['misc'],[]
115,0.16666666666666666,0.16666666666666666,,nixon,Nixon,We want to see that they do have adequate medical care.,False,False,False,False,[],False,[],False,,False,,False,[],['adequate medical care'],[],[],healthcare,['misc'],[]
116,0.0,0.0,,nixon,Nixon,The question is the means.,False,False,False,False,[],False,[],False,,False,,False,[],[],[],[],misc,['misc'],[]
117,0.5,0.5,,nixon,Nixon,I think that the means that I advocate will reach that goal better than the means that he advocates.,False,False,False,False,[],False,[],False,,False,,False,[],[],[],[],misc,['misc'],[]
118,0.21666666666666665,0.38333333333333336,,nixon,Nixon,"I could give better examples, but for - for whatever it is, whether it's in the field of housing, or health, or medical care, or schools, or the eh- development of electric power, we have programs which we believe will move America, move her forward and build on the wonderful record that we have made over these past seven and a half years.",False,False,False,False,[],False,[],False,,False,,False,[],"['medical care', 'eh- development', 'electric power', 'america', 'wonderful record']",[],[],"healthcare, education, c-energy",['foreign-policy'],[]
119,0.2,0.2,,nixon,Nixon,"Now, when we look at these programs, might I suggest that in evaluating them we often have a tendency to say that the test of a program is how much you're spending.",False,False,False,False,[],False,[],False,,False,,False,[],"[""'re spending""]",[],[],misc,['misc'],[]
120,0.5,0.5,,nixon,Nixon,I will concede that in all the areas to which I have referred Senator Kennedy would have the spe- federal government spend more than I would have it spend.,False,False,True,False,[],False,[],False,,False,,True,['kennedy'],"['kennedy', 'federal government']",[],[],kennedy,['misc'],[]
121,0.0,0.0,,nixon,Nixon,I costed out the cost of the Democratic platform.,False,False,False,False,[],False,[],False,,False,,False,[],['democratic platform'],[],[],deficit,['misc'],[]
122,0.25,0.25,,nixon,Nixon,It runs a minimum of thirteen and two-tenths billions dollars a year more than we are presently spending to a maximum of eighteen billion dollars a year more than we're presently spending.,False,False,False,False,[],False,[],False,,False,,False,[],['two-tenths billions dollars'],[],[],deficit,['misc'],[]
123,0.5,0.5,,nixon,Nixon,Now the Republican platform will cost more too.,False,False,False,False,[],False,[],False,,False,,False,[],['republican'],[],[],deficit,['misc'],[]
124,0.3333333333333333,0.3333333333333333,,nixon,Nixon,"It will cost a minimum of four billion dollars a year more, a maximum of four and nine-tenths billion dollar a year more than we're presently spending.",False,False,False,False,[],False,[],False,,False,,False,[],[],[],[],deficit,['misc'],[]
125,0.09375,0.59375,,nixon,Nixon,"Now, does this mean that his program is better than ours? Not at all.",False,False,False,False,[],False,[],False,,False,,False,[],[],[],[],kennedy,['misc'],[]
126,0.35,0.35,,nixon,Nixon,Because it isn't a question of how much the federal government spends; it isn't a question of which government does the most.,False,False,False,False,[],False,[],False,,False,,False,[],['federal government'],[],[],misc,['misc'],[]
127,0.2857142857142857,0.5357142857142857,,nixon,Nixon,It is a question of which administration does the right thing.,False,False,False,False,[],False,[],False,,False,,False,[],['right thing'],[],[],misc,['misc'],[]
128,0.45,0.9,,nixon,Nixon,"And in our case, I do believe that our programs will stimulate the creative energies of a hundred and eighty million free Americans.",False,False,False,False,[],False,[],False,,False,,False,[],['creative energies'],[],[],economy,['misc'],[]
129,0.1875,0.6875,,nixon,Nixon,"I believe the programs that Senator Kennedy advocates will have a tendency to stifle those creative energies, I believe in other words, that his program would lead to the stagnation of the motive power that we need in this country to get progress.",False,False,True,False,[],False,[],False,,False,,True,['kennedy'],"['kennedy', 'creative energies', 'motive power']",[],[],"kennedy, america",['misc'],[]
130,-0.2,0.7,,nixon,Nixon,"The final point that I would like to make is this: Senator Kennedy has suggested in his speeches that we lack compassion for the poor, for the old, and for others that are unfortunate.",False,False,True,False,[],False,[],False,,False,,True,['kennedy'],"['final point', 'kennedy', 'lack compassion']",[],[],kennedy,['misc'],[]
131,0.5,0.5,,nixon,Nixon,Let us understand throughout this campaign that his motives and mine are sincere.,False,False,False,False,[],False,[],False,,False,,False,[],[],[],[],kennedy,['misc'],[]
132,-0.4,0.6,,nixon,Nixon,I know what it means to be poor.,False,False,False,False,[],False,[],False,,False,,False,[],[],[],[],jobs,['misc'],[]
133,0.0,0.0,,nixon,Nixon,I know what it means to see people who are unemployed.,False,False,False,False,[],False,[],False,,False,,False,[],[],[],[],jobs,['misc'],[]
134,0.0,0.7,,nixon,Nixon,"I know Senator Kennedy feels as deeply about these problems as I do, but our disagreement is not about the goals for America but only about the means to reach those goals.",False,False,True,False,[],False,[],False,,False,,True,['kennedy'],"['kennedy', 'america']",[],[],"kennedy, america",['misc'],[]
135,0.0,0.0,,moderator,Moderator,"Thank you, Mr. Nixon.",False,False,False,False,[],False,[],False,,False,,True,['nixon'],[],[],[],nixon,['misc'],[]
136,0.0,0.0,,moderator,Moderator,"That completes the opening statements, and now the candidates will answer questions or comment upon one another's answers to questions, put by correspondents of the networks.",False,False,False,False,[],False,[],False,,False,,False,[],"['opening statements', ""'s answers""]",[],[],question,['misc'],[]
137,0.25,0.3333333333333333,,moderator,Moderator,The first question to Senator Kennedy from Mr. Fleming.,False,False,False,False,[],False,[],False,,False,,True,['kennedy'],['kennedy'],[],[],question,['misc'],[]
138,-0.3,1.0,,moderator,Moderator,"Senator, the Vice President in his campaign has said that you were naive and at times immature.",False,False,False,False,[],False,[],False,,False,,False,[],"['vice president', 'times immature']",[],[],kennedy,['misc'],[]
139,0.0,0.0,,moderator,Moderator,He has raised the question of leadership.,False,False,False,False,[],False,[],False,,False,,False,[],[],[],[],nixon,['misc'],[]
140,0.0,0.0,,moderator,Moderator,"On this issue, why do you think people should vote for you rather than the Vice President?",False,False,False,False,[],False,[],False,,False,,False,[],['vice president'],[],[],kennedy,['misc'],[]
141,0.0,0.0,,kennedy,Kennedy,"Well, the Vice President and I came to the Congress together 1946; we both served in the Labor Committee.",False,False,False,False,[],False,[],False,,False,,False,[],"['vice president', 'congress', 'labor committee']",[],[],nixon,['misc'],[]
142,0.0,0.125,,kennedy,Kennedy,"I've been there now for fourteen years, the same period of time that he has, so that our experience in uh - government is comparable.",False,False,False,False,[],False,[],False,,False,,False,[],[],[],[],nixon,['misc'],[]
143,0.0,0.0,,kennedy,Kennedy,"Secondly, I think the question is uh - what are the programs that we advocate, what is the party record that we lead? I come out of the Democratic party, which in this century has produced Woodrow Wilson and Franklin Roosevelt and Harry Truman, and which supported and sustained these programs which I've discussed tonight.",False,False,False,False,[],False,[],False,,False,,False,[],"['secondly', 'party record', 'democratic party', 'woodrow wilson', 'franklin roosevelt', 'harry truman']",[],[],past,['misc'],[]
144,0.0,0.0,,kennedy,Kennedy,Mr. Nixon comes out of the Republican party.,False,False,True,False,[],False,[],False,,False,,True,['nixon'],['republican'],[],[],nixon,['misc'],[]
145,0.0,0.0,,kennedy,Kennedy,He was nominated by it.,False,False,False,False,[],False,[],False,,False,,False,[],[],[],[],nixon,['misc'],[]
146,0.1,0.2733333333333333,,kennedy,Kennedy,"And it is a fact that through most of these last twenty-five years the Republican leadership has opposed federal aid for education, medical care for the aged, development of the Tennessee Valley, development of our natural resources.",False,False,False,False,[],False,[],False,,False,,False,[],"['twenty-five years', 'republican', 'federal aid', 'medical care', 'tennessee', 'natural resources']",[],[],"education, healthcare, economy",['education'],[]
147,0.6,0.8,,kennedy,Kennedy,I think Mr. Nixon is an effective leader of his party.,False,False,True,False,[],False,[],False,,False,,True,['nixon'],['effective leader'],[],[],nixon,['misc'],[]
148,0.0,0.125,,kennedy,Kennedy,I hope he would grant me the same.,False,False,False,False,[],False,[],False,,False,,False,[],[],[],[],kennedy,['misc'],[]
149,0.0,0.0,,kennedy,Kennedy,The question before us is: which point of view and which party do we want to lead the United States?,False,False,False,False,[],False,[],False,,False,,False,[],[],[],[],america,['misc'],[]
150,0.0,0.0,,moderator,Moderator,"Mr. Nixon, would you like to comment on that statement?",False,False,False,False,[],False,[],False,,False,,True,['nixon'],[],[],[],nixon,['misc'],[]
151,0.0,0.0,,nixon,Nixon,I have no comment.,False,False,False,False,[],False,[],False,,False,,False,[],[],[],[],misc,['misc'],[]
152,0.0,0.0,,moderator,Moderator,The next question,False,False,False,False,[],False,[],False,,False,,False,[],[],[],[],question,['misc'],[]
153,0.0,0.0,,moderator,Moderator,"Mr. Vice President, your campaign stresses the value of your eight year experience, and the question arises as to whether that experience was as an observer or as a participant or as an initiator of policy-making.",False,False,False,False,[],False,[],False,,False,,False,[],"['vice president', 'campaign stresses', 'year experience']",[],[],question,['misc'],[]
154,0.03125,0.2833333333333333,,moderator,Moderator,Would you tell us please specifically what major proposals you have made in the last eight years that have been adopted by the Administration?,False,False,False,False,[],False,[],False,,False,,False,[],['major proposals'],[],[],question,['misc'],[]
155,-0.3333333333333333,0.5833333333333334,,nixon,Nixon,It would be rather difficult to cover them in eight and- in two and a half minutes.,False,False,False,False,[],False,[],False,,False,,False,[],[],[],[],misc,['misc'],[]
156,0.0,0.0,,nixon,Nixon,I would suggest that these proposals could be mentioned.,False,False,False,False,[],False,[],False,,False,,False,[],[],[],[],misc,['misc'],[]
157,0.0625,0.22916666666666666,,nixon,Nixon,"First, after each of my foreign trips I have made recommendations that have been adopted.",False,False,False,False,[],False,[],False,,False,,False,[],['foreign trips'],[],[],trade,['misc'],[]
158,0.2125,0.44999999999999996,,nixon,Nixon,"For example, after my first trip abroad - abroad, I strongly recommended that we increase our exchange programs particularly as they related to exchange of persons of leaders in the labor field and in the information field.",False,False,False,False,[],False,[],False,,False,,False,[],"['exchange programs', 'labor field', 'information field']",[],[],trade,['economic-inequality'],['economic-inequality']
159,0.16666666666666666,0.20833333333333334,,nixon,Nixon,"After my trip to South America, I made recommendations that a separate inter-American lending agency be set up which the South American nations would like much better than a lend- than to participate in the lending agencies which treated all the countries of the world the same.",False,False,False,False,[],False,[],False,,False,,False,[],"['america', 'separate inter-american', 'south american nations']",[],[],misc,['misc'],[]
160,-0.08333333333333333,0.5833333333333334,,nixon,Nixon,"Uh - I have made other recommendations after each of the other trips; for example, after my trip abroad to Hungary I made some recommendations with regard to the Hungarian refugee situation which were adopted, not only by the President but some of them were enacted into law by the Congress.",False,False,False,False,[],False,[],False,,False,,False,[],"['uh', 'hungary', 'hungarian', 'refugee situation', 'congress']",[],[],immigration,['immigration'],['immigration']
161,0.4,0.5,,nixon,Nixon,"Within the Administration, as a chairman of the President's Committee on Price Stability and Economic Growth, I have had the opportunity to make recommendations which have been adopted within the Administration and which I think have been reasonably effective.",False,False,False,False,[],False,[],False,,False,,False,[],"[""president 's committee"", 'price stability', 'economic growth']",[],[],economy,['misc'],[]
162,0.6,0.8,,nixon,Nixon,I know Senator Kennedy suggested in his speech at Cleveland yesterday that that committee had not been particularly effective.,False,False,True,False,[],False,[],False,,False,,True,['kennedy'],"['kennedy', 'cleveland']",[],[],"kennedy, economy",['misc'],[]
163,0.1,0.65,,nixon,Nixon,I would only suggest that while we do not take the credit for it - I would not presume to - that since that committee has been formed the price line has been held very well within the United States.,False,False,False,False,[],False,[],False,,False,,False,[],['price line'],[],[],economy,['misc'],[]
164,-0.08333333333333333,0.08333333333333333,,kennedy,Kennedy,"Well, I would say in the latter that the - and that's what I found uh - somewhat unsatisfactory about the figures uh - Mr. Nixon, that you used in your previous speech, when you talked about the Truman Administration.",False,False,True,False,[],False,[],True,nixon,False,,True,['nixon'],"['figures uh', 'previous speech', 'truman']",[],[],economy,['misc'],[]
165,-0.16666666666666666,0.30833333333333335,,kennedy,Kennedy,"You - Mr. Truman came to office in nineteen uh - forty-four and at the end of the war, and uh - difficulties that were facing the United States during that period of transition - 1946 when price controls were lifted - so it's rather difficult to use an overall figure taking those seven and a half years and comparing them to the last eight years.",False,False,False,False,[],False,[],False,,False,,False,[],['overall figure'],[],[],economy,"['foreign-policy', 'social-justice']",['social-justice']
166,0.0,0.022222222222222223,,kennedy,Kennedy,I prefer to take the overall percentage record of the last twenty years of the Democrats and the eight years of the Republicans to show an overall period of growth.,False,False,False,False,[],False,[],False,,False,,False,[],"['overall percentage record', 'overall period']",[],[],economy,['misc'],[]
167,0.04464285714285714,0.4107142857142857,,kennedy,Kennedy,In regard to uh - price stability uh - I'm not aware that that committee did produce recommendations that ever were certainly before the Congress from the point of view of legislation in regard to controlling prices.,False,False,False,False,[],False,[],False,,False,,False,[],"['price stability uh', 'congress']",[],[],economy,['foreign-policy'],[]
168,0.06666666666666667,0.6,,kennedy,Kennedy,"In regard to the exchange of students and labor unions, I am chairman of the subcommittee on Africa and I think that one of the most unfortunate phases of our policy towards that country was the very minute number of exchanges that we had.",False,False,False,False,[],False,[],False,,False,,False,[],"['labor unions', 'africa', 'unfortunate phases', 'minute number']",[],[],"education, trade","['foreign-policy', 'economic-inequality']",[]
169,0.35,0.65,,kennedy,Kennedy,I think it's true of Latin America also.,False,False,False,False,[],False,[],False,,False,,False,[],['america'],[],[],misc,['misc'],[]
170,0.011111111111111127,0.35555555555555557,,kennedy,Kennedy,"We did come forward with a program of students for the Congo of over three hundred which was more than the federal government had for all of Africa the previous year, so that I don't think that uh - we have moved at least in those two areas with sufficient vigor.",False,False,False,False,[],False,[],False,,False,,False,[],"['congo', 'federal government', 'africa', 'previous year', 'sufficient vigor']",[],[],"education, trade",['foreign-policy'],[]
171,0.0,0.0,,moderator,Moderator,The next question to Senator Kennedy from Mr. Warren.,False,False,False,False,[],False,[],False,,False,,True,['kennedy'],['kennedy'],[],[],kennedy,['misc'],[]
172,-0.1,0.21666666666666667,,moderator,Moderator,"Uh - Senator Kennedy, during your brief speech a few minutes ago you mentioned farm surpluses.",False,False,False,False,[],False,[],False,,False,,True,['kennedy'],"['uh', 'kennedy', 'brief speech', 'farm surpluses']",[],[],"question, farming",['misc'],[]
173,0.0,0.0,,kennedy,Kennedy,That's correct.,False,False,False,False,[],False,[],False,,False,,False,[],[],[],[],misc,['misc'],[]
174,0.0,0.0,,moderator,Moderator,I'd like to ask this,False,False,False,False,[],False,[],False,,False,,False,[],[],[],[],question,['misc'],[]
175,0.21428571428571427,0.5714285714285714,,moderator,Moderator,"Lots of people, I think, don't understand why the government pays farmers for not producing certain crops or paying farmers if they overproduce for that matter.",False,False,False,False,[],False,[],False,,False,,False,[],"['lots', 'certain crops']",[],[],"question, farming",['misc'],[]
176,0.21428571428571427,0.5714285714285714,,moderator,Moderator,"Now, let me ask, sir, why can't the farmer operate like the business man who operates a factory? If an auto company overproduces a certain model car Uncle Sam doesn't step in and buy up the surplus.",False,False,False,False,[],False,[],False,,False,,False,[],"[""ca n't"", 'business man', 'auto company overproduces', 'certain model car', 'uncle sam', ""n't step""]",[],[],"question, farming",['misc'],[]
177,0.0,0.3333333333333333,,moderator,Moderator,Why this constant courting of the farmer?,False,False,False,False,[],False,[],False,,False,,False,[],[],[],[],"question, farming",['misc'],[]
178,0.15000000000000002,0.30000000000000004,,kennedy,Kennedy,"Well, because I think that if the federal government moved out of the program and withdrew its supports uh - then I think you would have complete uh - economic chaos.",False,False,False,False,[],False,[],False,,False,,False,[],"['federal government', 'supports uh', 'complete uh', 'economic chaos']",[],[],economy,['misc'],[]
179,0.0,0.0,,kennedy,Kennedy,The farmer plants in the spring and harvests in the fall.,False,False,False,False,[],False,[],False,,False,,False,[],['farmer plants'],[],[],farming,['misc'],[]
180,0.0,0.0,,kennedy,Kennedy,There are hundreds of thousands of them.,False,False,False,False,[],False,[],False,,False,,False,[],[],[],[],farming,['misc'],[]
181,0.05000000000000001,0.375,,kennedy,Kennedy,They really don't - they're not able to control their market very well.,False,False,False,False,[],False,[],False,,False,,False,[],[],[],[],economy,['misc'],[]
182,0.25,0.3125,,kennedy,Kennedy,"They bring their crops in or their livestock in, many of them about the same time.",False,False,False,False,[],False,[],False,,False,,False,[],[],[],[],farming,['misc'],[]
183,0.1823809523809524,0.5214285714285715,,kennedy,Kennedy,They have only a few purchasers that buy their milk or their hogs - a few large companies in many cases - and therefore the farmer is not in a position to bargain very effectively in the market place.,False,False,False,False,[],False,[],False,,False,,False,[],"['large companies', 'market place']",[],[],"economy, farming",['misc'],[]
184,0.4,0.8,,kennedy,Kennedy,I think the experience of the twenties has shown what a free market could do to agriculture.,False,False,False,False,[],False,[],False,,False,,False,[],['free market'],[],[],"farming, economy",['misc'],[]
185,0.0,0.0,,kennedy,Kennedy,"And if the agricultural economy collapses, then the economy of the rest of the United States sooner or later will collapse.",False,False,False,False,[],False,[],False,,False,,False,[],['agricultural economy collapses'],[],[],"farming, economy",['economic-inequality'],[]
186,0.0,0.0,,kennedy,Kennedy,The farmers are the number one market for the automobile industry of the United States.,False,False,False,False,[],False,[],False,,False,,False,[],['automobile industry'],[],[],farming,['misc'],[]
187,0.0,0.0,,kennedy,Kennedy,The automobile industry is the number one market for steel.,False,False,False,False,[],False,[],False,,False,,False,[],['automobile industry'],[],[],"steel, economy",['misc'],[]
188,-0.0625,0.5,,kennedy,Kennedy,"So if the farmers' economy continues to decline as sharply as it has in recent years, then I think you would have a recession in the rest of the country.",False,False,False,False,[],False,[],False,,False,,False,[],['recent years'],[],[],economy,['economic-inequality'],[]
189,0.7,0.6000000000000001,,kennedy,Kennedy,So I think the case for the government intervention is a good one.,False,False,False,False,[],False,[],False,,False,,False,[],['government intervention'],[],[],misc,['misc'],[]
