index,polarity,subjectivity,timestamp,speaker,speaker_name,text,applause,laughter,interaction,attack,attack_target,agree,agree_target,interruption,interrupt_target,defense,defense_against,reference,mentions,noun_phrases,people,locations,topic,autotopic,first_mention
190,0.05,0.325,,kennedy,Kennedy,"Secondly, my objection to present farm policy is that there are no effective controls to bring supply and demand into better balance.",False,False,False,False,[],False,[],False,,False,,False,[],"['secondly', 'present farm policy', 'effective controls']",[],[],economy,['misc'],[]
191,0.3,0.1,,kennedy,Kennedy,"The dropping of the support price in order to limit production does not work, and we now have the highest uh - surpluses - nine billion dollars worth.",False,False,False,False,[],False,[],False,,False,,False,[],"['support price', 'limit production', 'dollars worth']",[],[],economy,['misc'],[]
192,0.1375,0.29166666666666663,,kennedy,Kennedy,We've had a uh - higher tax load from the Treasury for the farmer in the last few years with the lowest farm income in many years.,False,False,False,False,[],False,[],False,,False,,False,[],"['tax load', 'farm income']",[],[],taxes,['taxes'],['taxes']
193,-0.5,0.3,,kennedy,Kennedy,I think that this farm policy has failed.,False,False,False,False,[],False,[],False,,False,,False,[],['farm policy'],[],[],farming,['misc'],[]
194,0.3,0.9,,kennedy,Kennedy,In my judgment the only policy that will work will be for effective supply and demand to be in balance.,False,False,False,False,[],False,[],False,,False,,False,[],[],[],[],economy,['misc'],[]
195,0.05,0.55,,kennedy,Kennedy,And that can only be done through governmental action.,False,False,False,False,[],False,[],False,,False,,False,[],['governmental action'],[],[],misc,['misc'],[]
196,0.3,0.4625,,kennedy,Kennedy,"I therefore suggest that in those basic commodities which are supported, that the federal government, after endorsement by the farmers in that commodity, attempt to bring supply and demand into balance - attempt effective production controls - so that we won't have that five or six per cent surplus which breaks the price fifteen or twenty per cent.",False,False,False,False,[],False,[],False,,False,,False,[],"['basic commodities', 'federal government', 'effective production', ""wo n't"", 'cent surplus']",[],[],economy,['misc'],[]
197,-0.5,0.3,,kennedy,Kennedy,I think Mr. Benson's program has failed.,False,False,False,False,[],False,[],False,,False,,False,[],[],[],[],misc,['misc'],[]
198,0.0,0.6,,kennedy,Kennedy,"And I must say, after reading the Vice President's speech before the farmers, as he read mine, I don't believe that it's very much different from Mr. Benson's.",False,False,False,False,[],False,[],False,,False,,False,[],"[""vice president 's speech""]",[],[],misc,['misc'],[]
199,0.6,0.8,,kennedy,Kennedy,I don't think it provides effective governmental controls.,False,False,False,False,[],False,[],False,,False,,False,[],['effective governmental controls'],[],[],misc,['misc'],[]
200,-0.075,0.2333333333333333,,kennedy,Kennedy,"I think the support prices are tied to the average market price of the last three years, which was Mr. Benson's theory.",False,False,False,False,[],False,[],False,,False,,False,[],"['support prices', 'average market price', ""'s theory""]",[],[],economy,['misc'],[]
201,-0.015000000000000003,0.325,,kennedy,Kennedy,I therefore do not believe that this is a sharp enough breach with the past to give us any hope of success for the future.,False,False,False,False,[],False,[],False,,False,,False,[],[],[],[],future,['misc'],[]
202,0.0,0.0,,moderator,Moderator,"Mr. Nixon, comment?",False,False,False,False,[],False,[],False,,False,,True,['nixon'],[],[],[],nixon,['misc'],[]
203,0.0,0.0,,nixon,Nixon,I of course disagree with Senator Kennedy insofar as his suggestions as to what should be done uh - with re- on the farm program.,False,False,True,False,[],False,[],False,,False,,True,['kennedy'],"['course disagree', 'kennedy', 'farm program']",[],[],"farming, kennedy",['misc'],[]
204,0.196875,0.671875,,nixon,Nixon,"He has made the suggestion that what we need is to move in the direction of more government controls, a suggestion that would also mean raising prices uh - that the consumers pay for products and im- and imposing upon the farmers uh - controls on acreage even far more than they have today.",False,False,False,False,[],False,[],False,,False,,False,[],"['prices uh', 'farmers uh']",[],[],economy,['misc'],[]
205,-0.5,0.9,,nixon,Nixon,I think this is the wrong direction.,False,False,False,False,[],False,[],False,,False,,False,[],['wrong direction'],[],[],misc,['misc'],[]
206,-0.125,0.1875,,nixon,Nixon,I don't think this has worked in the past; I do not think it will work in the future.,False,False,False,False,[],False,[],False,,False,,False,[],[],[],[],future,['misc'],[]
207,0.0,0.0,,nixon,Nixon,The program that I have advocated is one which departs from the present program that we have in this respect.,False,False,False,False,[],False,[],False,,False,,False,[],['present program'],[],[],farming,['misc'],[]
208,-0.1,0.1,,nixon,Nixon,It recognizes that the government has a responsibility to get the farmer out of the trouble he presently is in because the government got him into it.,False,False,False,False,[],False,[],False,,False,,False,[],[],[],[],economy,['misc'],[]
209,0.0,0.0,,nixon,Nixon,And that's the fundamental reason why we can't let the farmer go by himself at the present time.,False,False,False,False,[],False,[],False,,False,,False,[],"['fundamental reason', ""ca n't"", 'present time']",[],[],farming,['misc'],[]
210,0.0,0.0,,nixon,Nixon,The farmer produced these surpluses because the government asked him to through legislation during the war.,False,False,False,False,[],False,[],False,,False,,False,[],[],[],[],farming,['foreign-policy'],[]
211,0.0,0.0,,nixon,Nixon,"Now that we have these surpluses, it's our responsibility to indemnify the farmer during that period that we get rid of the farmer uh - the surpluses.",False,False,False,False,[],False,[],False,,False,,False,[],['farmer uh'],[],[],misc,['misc'],[]
212,0.0,0.25,,nixon,Nixon,"Until we get the surpluses off the farmer's back, however, we should have a program such as I announced, which will see that farm income holds up.",False,False,False,False,[],False,[],False,,False,,False,[],"[""farmer 's"", 'farm income']",[],[],farming,['misc'],[]
213,0.6,0.9,,nixon,Nixon,"But I would propose holding that income up not through a type of program that Senator Kennedy has suggested that would raise prices, but one that would indemnify the farmer, pay the farmer in kind uh - from the products which are in surplus.",False,False,True,False,[],False,[],False,,False,,True,['kennedy'],"['kennedy', 'kind uh']",[],[],economy,['misc'],[]
214,0.0,0.0,,moderator,Moderator,The next question to Vice President Nixon from Mr. Vanocur.,False,False,False,False,[],False,[],False,,False,,True,['nixon'],"['vice president', 'nixon']",[],[],nixon,['misc'],[]
215,0.52,1.0,,moderator,Moderator,"Uh - Mr. Vice President, since the question of executive leadership is a very important campaign issue, I'd like to follow Mr. Novins' question.",False,False,False,False,[],False,[],False,,False,,False,[],"['uh', 'vice president', 'executive leadership', 'important campaign issue']",[],[],question,['misc'],[]
216,0.25,0.2833333333333333,,moderator,Moderator,"Now, Republican campaign slogans - you'll see them on signs around the country as you did last week - say it's experience that counts - that's over a picture of yourself; sir uh - implying that you've had more governmental executive decision-making uh - experience than uh - your opponent.",False,False,False,False,[],False,[],False,,False,,False,[],"['republican', 'campaign slogans', ""'s experience"", 'sir uh', 'governmental executive decision-making uh']",[],[],question,['misc'],[]
217,0.0625,0.5,,moderator,Moderator,"Now, in his news conference on August twenty-fourth, President Eisenhower was asked to give one example of a major idea of yours that he adopted.",False,False,False,False,[],False,[],False,,False,,False,[],"['news conference', 'august', 'eisenhower', 'major idea']",[],[],"question, eisenhower",['misc'],[]
218,0.0,0.0,,moderator,Moderator,"His reply was, and I'm quoting; ""If you give me a week I might think of one.",False,False,False,False,[],False,[],False,,False,,False,[],[],[],[],misc,['misc'],[]
219,0.0,0.0,,moderator,Moderator,"I don't remember."" Now that was a month ago, sir, and the President hasn't brought it up since, and I'm wondering, sir, if you can clarify which version is correct - the one put out by Republican campaign leaders or the one put out by President Eisenhower?",False,False,False,False,[],False,[],False,,False,,False,[],"['republican', 'campaign leaders', 'eisenhower']",[],[],question,['misc'],[]
220,0.0,0.0,,nixon,Nixon,"Well, I would suggest, Mr. Vanocur, that uh - if you know the President, that was probably a facetious remarK. Uh - I would also suggest that insofar as his statement is concerned, that I think it would be improper for the President of the United States to disclose uh - the instances in which members of his official family had made recommendations, as I have made them through the years to him, which he has accepted or rejected.",False,False,False,False,[],False,[],False,,False,,False,[],"['facetious remark', 'uh', 'disclose uh', 'official family']",[],[],eisenhower,['misc'],[]
221,0.025000000000000005,0.20166666666666666,,nixon,Nixon,The President has always maintained and very properly so that he is entitled to get what advice he wants from his cabinet and from his other advisers without disclosing that to anybody - including as a matter of fact the Congress.,False,False,False,False,[],False,[],False,,False,,False,[],['congress'],[],[],eisenhower,['misc'],[]
222,0.0,1.0,,nixon,Nixon,"Now, I can only say this.",False,False,False,False,[],False,[],False,,False,,False,[],[],[],[],misc,['misc'],[]
223,0.0,0.0,,nixon,Nixon,Through the years I have sat in the National Security Council.,False,False,False,False,[],False,[],False,,False,,False,[],['national security council'],[],[],safety,['misc'],[]
224,0.0,0.0,,nixon,Nixon,I have been in the cabinet.,False,False,False,False,[],False,[],False,,False,,False,[],[],[],[],misc,['misc'],[]
225,0.0,0.0,,nixon,Nixon,I have met with the legislative leaders.,False,False,False,False,[],False,[],False,,False,,False,[],['legislative leaders'],[],[],misc,['misc'],[]
226,0.3375,0.5625,,nixon,Nixon,"I have met with the President when he made the great decisions with regard to Lebanon, Quemoy and Matsu, other matters.",False,False,False,False,[],False,[],False,,False,,False,[],"['great decisions', 'lebanon', 'quemoy', 'matsu']",[],[],eisenhower,['misc'],[]
227,0.0,0.0,,nixon,Nixon,The President has asked for my advice.,False,False,False,False,[],False,[],False,,False,,False,[],[],[],[],eisenhower,['misc'],[]
228,0.0,0.0,,nixon,Nixon,I have given it.,False,False,False,False,[],False,[],False,,False,,False,[],[],[],[],misc,['misc'],[]
229,0.0,0.0,,nixon,Nixon,Sometimes my advice has been taken.,False,False,False,False,[],False,[],False,,False,,False,[],[],[],[],misc,['misc'],[]
230,0.0,0.0,,nixon,Nixon,Sometimes it has not.,False,False,False,False,[],False,[],False,,False,,False,[],[],[],[],misc,['misc'],[]
231,0.0,0.0,,nixon,Nixon,I do not say that I have made the decisions.,False,False,False,False,[],False,[],False,,False,,False,[],[],[],[],misc,['misc'],[]
232,0.03125,0.75,,nixon,Nixon,"And I would say that no president should ever allow anybody else to make the major decisions, The president only makes the decisions.",False,False,False,False,[],False,[],False,,False,,False,[],['major decisions'],[],[],misc,['misc'],[]
233,0.0,0.0,,nixon,Nixon,All that his advisers do is to give counsel when he asks for it.,False,False,False,False,[],False,[],False,,False,,False,[],[],[],[],misc,['misc'],[]
234,0.1,1.0,,nixon,Nixon,"As far as what experience counts and whether that is experience that counts, that isn't for me to say.",False,False,False,False,[],False,[],False,,False,,False,[],['experience counts'],[],[],misc,['misc'],[]
235,0.0,1.0,,nixon,Nixon,Uh - I can only say that my experience is there for the people to consider; Senator Kennedy's is there for the people to consider.,False,False,False,False,[],False,[],False,,False,,False,[],"['uh', 'kennedy']",[],[],kennedy,['misc'],[]
236,0.0,0.125,,nixon,Nixon,"As he pointed out, we came to the Congress in the same year.",False,False,False,False,[],False,[],False,,False,,False,[],['congress'],[],[],kennedy,['misc'],[]
237,0.0,0.6,,nixon,Nixon,His experience has been different from mine.,False,False,False,False,[],False,[],False,,False,,False,[],[],[],[],kennedy,['misc'],[]
238,0.0,0.0,,nixon,Nixon,Mine has been in the executive branch.,False,False,False,False,[],False,[],False,,False,,False,[],[],[],[],nixon,['misc'],[]
239,0.0,0.0,,nixon,Nixon,His has been in the legislative branch.,False,False,False,False,[],False,[],False,,False,,False,[],[],[],[],kennedy,['misc'],[]
240,0.0,0.0,,nixon,Nixon,I would say that the people now have the opportunity to evaluate his as against mine and I think both he and I are going to abide by whatever the people decide.,False,False,False,False,[],False,[],False,,False,,False,[],[],[],[],kennedy,['misc'],[]
241,0.0,0.0,,moderator,Moderator,Senator Kennedy.,False,False,False,False,[],False,[],False,,False,,True,['kennedy'],['kennedy'],[],[],kennedy,['misc'],[]
242,0.0,0.125,,kennedy,Kennedy,"Well, I'll just say that the question is of experience and the question also is uh - what our judgment is of the future, and what our goals are for the United States, and what ability we have to implement those goals.",False,False,False,False,[],False,[],False,,False,,False,[],[],[],[],future,['misc'],[]
243,-0.1875,0.5,,kennedy,Kennedy,Abraham Lincoln came to the presidency in 1860 after a rather little known uh - session in the House of Representatives and after being defeated for the Senate in fifty-eight and was a distinguished president.,False,False,False,False,[],False,[],False,,False,,False,[],['abraham lincoln'],[],[],lincoln,['misc'],[]
244,-0.10714285714285714,0.5714285714285714,,kennedy,Kennedy,There's no certain road to the presidency.,False,False,False,False,[],False,[],False,,False,,False,[],['certain road'],[],[],misc,['misc'],[]
245,0.75,0.95,,kennedy,Kennedy,There are no guarantees that uh - if you take uh - one road or another that you will be a successful president.,False,False,False,False,[],False,[],False,,False,,False,[],['successful president'],[],[],misc,['misc'],[]
246,0.0,0.0,,kennedy,Kennedy,I have been in the Congress for fourteen years.,False,False,False,False,[],False,[],False,,False,,False,[],['congress'],[],[],nixon,['misc'],[]
247,-0.0625,0.22083333333333333,,kennedy,Kennedy,I have voted in the last uh - eight years uh - and the Vice President was uh - presiding over the Senate and meeting his other responsibilities.,False,False,False,False,[],False,[],False,,False,,False,[],"['years uh', 'vice president']",[],[],nixon,['misc'],[]
248,-0.041666666666666664,0.4083333333333334,,kennedy,Kennedy,"I have met met uh - decisions over eight hundred times on matters which affect not only the domestic security of the United States, but as a member of the Senate Foreign Relations Committee.",False,False,False,False,[],False,[],False,,False,,False,[],['domestic security'],[],[],"safety, trade",['misc'],[]
249,0.2,0.2,,kennedy,Kennedy,The question really is: which candidate and which party can meet the problems that the United States is going to face in the sixties?,False,False,False,False,[],False,[],False,,False,,False,[],[],[],[],america,['misc'],[]
250,0.0,0.0,,moderator,Moderator,The next question to Senator Kennedy from Mr. Novins.,False,False,False,False,[],False,[],False,,False,,True,['kennedy'],['kennedy'],[],[],kennedy,['misc'],[]
251,0.025,0.25625,,moderator,Moderator,"Senator Kennedy, in connection with these problems of the future that you speak of, and the program that you enunciated earlier in your direct talk, you call for expanding some of the welfare programs for schools, for teacher salaries, medical care, and so forth; but you also call for reducing the federal debt.",False,False,False,False,[],False,[],False,,False,,True,['kennedy'],"['kennedy', 'direct talk', 'welfare programs', 'teacher salaries', 'medical care', 'federal debt']",[],[],"question, education, jobs, healthcare, deficit",['misc'],[]
252,0.0,0.0,,moderator,Moderator,"And I'm wondering how you, if you're president in January, would go about paying the bill for all this.",False,False,False,False,[],False,[],False,,False,,False,[],"[""'re president"", 'january']",[],[],"question, deficit",['misc'],[]
253,-0.3125,0.6875,,moderator,Moderator,Does this mean that you?,False,False,False,False,[],False,[],False,,False,,False,[],['does'],[],[],question,['misc'],[]
254,0.0,0.0,,kennedy,Kennedy,I didn't indicate.,False,False,False,False,[],False,[],False,,False,,False,[],[],[],[],misc,['misc'],[]
255,0.38,0.4425,,kennedy,Kennedy,"I did not advocate reducing the federal debt because I don't believe that you're going to be able to reduce the federal debt very much in nineteen sixty-one, two, or three.",False,False,False,False,[],False,[],False,,False,,False,[],"['federal debt', 'federal debt']",[],[],deficit,['misc'],[]
256,-0.2,0.5,,kennedy,Kennedy,"I think you have heavy obligations which affect our security, which we're going to have to meet.",False,False,False,False,[],False,[],False,,False,,False,[],['heavy obligations'],[],[],safety,['misc'],[]
257,0.5,0.625,,kennedy,Kennedy,"And therefore I've never suggested we should uh - be able to retire the debt substantially, or even at all in nineteen sixty-one or two.",False,False,False,False,[],False,[],False,,False,,False,[],[],[],[],deficit,['misc'],[]
258,0.0,0.0,,moderator,Moderator,"Senator, I believe in - in one of your speeches -",False,False,False,False,[],False,[],False,,False,,False,[],[],[],[],kennedy,['misc'],[]
259,0.0,0.0,,kennedy,Kennedy,"No, never.",False,False,False,False,[],False,[],False,,False,,False,[],[],[],[],misc,['misc'],[]
260,0.0,0.0,,moderator,Moderator,- you suggested that reducing the interest rate would help toward -,False,False,False,False,[],False,[],False,,False,,False,[],['interest rate'],[],[],economy,['foreign-policy'],[]
261,0.0,0.0,,kennedy,Kennedy,No.,False,False,False,False,[],False,[],False,,False,,False,[],[],[],[],misc,['misc'],[]
262,0.0,0.0,,kennedy,Kennedy,No.,False,False,False,False,[],False,[],False,,False,,False,[],[],[],[],misc,['misc'],[]
263,-0.017559523809523803,0.5068452380952381,,kennedy,Kennedy,"In my judgment, the hard money, tight money policy, fiscal policy of this Administration has contributed to the slow-down in our economy, which helped bring the recession of fifty-four; which made the recession of fifty-eight rather intense, and which has slowed, somewhat, our economic activity in 1960.",False,False,False,False,[],False,[],False,,False,,False,[],"['hard money', 'tight money policy', 'fiscal policy', 'economic activity']",[],[],economy,['economic-inequality'],[]
264,0.5,0.65,,kennedy,Kennedy,"What I have talked about, however, the kind of programs that I've talked about, in my judgment, are uh - fiscally sound.",False,False,False,False,[],False,[],False,,False,,False,[],[],[],[],economy,['misc'],[]
265,-0.022222222222222227,0.15555555555555556,,kennedy,Kennedy,"Medical care for the aged, I would put under social security.",False,False,False,False,[],False,[],False,,False,,False,[],"['medical care', 'social security']",[],[],healthcare,['misc'],[]
266,0.0,0.0,,kennedy,Kennedy,The Vice President and I disagree on this.,False,False,False,False,[],False,[],False,,False,,False,[],['vice president'],[],[],nixon,['misc'],[]
267,0.0,0.0,,kennedy,Kennedy,"The program - the Javits-Nixon or the Nixon-Javits program - would have cost, if fully used uh - six hundred million dollars by the government per year, and six hundred million dollars by the state.",False,False,False,False,[],False,[],False,,False,,False,[],"['javits-nixon', 'nixon-javits']",[],[],misc,['misc'],[]
268,-0.08333333333333333,0.15,,kennedy,Kennedy,"The program which I advocated, which failed by five votes in the United States Senate, would have put medical care for the aged in Social Security, and would have been paid for through the Social Security System and the Social Security tax.",False,False,False,False,[],False,[],False,,False,,False,[],"['medical care', 'social security', 'social security system', 'social security tax']",[],[],"healthcare, taxes",['taxes'],[]
269,0.0,0.0,,kennedy,Kennedy,"Secondly, I support federal aid to education and federal aid for teachers' salaries.",False,False,False,False,[],False,[],False,,False,,False,[],"['secondly', 'federal aid', 'federal aid']",[],[],"education,",['education'],[]
270,0.7,0.6000000000000001,,kennedy,Kennedy,I think that's a good investment.,False,False,False,False,[],False,[],False,,False,,False,[],['good investment'],[],[],misc,['misc'],[]
271,0.0,0.0,,kennedy,Kennedy,I think we're going to have to do it.,False,False,False,False,[],False,[],False,,False,,False,[],[],[],[],misc,['misc'],[]
272,0.27777777777777773,0.4444444444444444,,kennedy,Kennedy,"And I think to heap the burden further on the property tax, which is already strained in many of our communities, will provide, will make sh- insure, in my opinion, that many of our children will not be adequately educated, and many of our teachers not adequately compensated.",False,False,False,False,[],False,[],False,,False,,False,[],['property tax'],[],[],"taxes, children",['taxes'],[]
273,0.0,0.25,,kennedy,Kennedy,There is no greater return to an economy or to a society than an educational system second to none.,False,False,False,False,[],False,[],False,,False,,False,[],['educational system'],[],[],"economy, education","['economic-inequality', 'education']",[]
274,0.03333333333333333,0.17500000000000002,,kennedy,Kennedy,"On the question of the development of natural resources, I would pay as you go in the sense that they would be balanced and the power revenues would bring back sufficient money to finance the projects, in the same way as the Tennessee Valley.",False,False,False,False,[],False,[],False,,False,,False,[],"['natural resources', 'power revenues', 'sufficient money', 'tennessee']",[],[],economy,['misc'],[]
275,0.0,0.0,,kennedy,Kennedy,I believe in the balanced budget.,False,False,False,False,[],False,[],False,,False,,False,[],[],[],[],deficit,['misc'],[]
276,-0.16666666666666666,0.8333333333333333,,kennedy,Kennedy,And the only conditions under which I would unbalance the budget would be if there was a grave national emergency or a serious recession.,False,False,False,False,[],False,[],False,,False,,False,[],"['grave national emergency', 'serious recession']",[],[],economy,['misc'],[]
277,0.11333333333333333,0.19999999999999998,,kennedy,Kennedy,"Otherwise, with a steady rate of economic growth - and Mr. Nixon and Mr. Rockefeller, in their meeting, said a five per cent economic growth would bring by 1962 ten billion dollars extra in tax revenues.",False,False,True,False,[],False,[],False,,False,,True,['nixon'],"['otherwise', 'steady rate', 'economic growth', 'economic growth', 'tax revenues']",[],[],economy,['taxes'],[]
278,0.0,0.3,,kennedy,Kennedy,"Whatever is brought in, I think that we can finance essential programs within a balanced budget, if business remains orderly.",False,False,False,False,[],False,[],False,,False,,False,[],['essential programs'],[],[],deficit,['misc'],[]
279,0.0,0.0,,moderator,Moderator,"Mr. Nixon, your comment?",False,False,False,False,[],False,[],False,,False,,True,['nixon'],[],[],[],nixon,['misc'],[]
280,0.0,0.0,,nixon,Nixon,Yes.,False,False,False,False,[],False,[],False,,False,,False,[],[],[],[],misc,['misc'],[]
281,-0.6,0.9,,nixon,Nixon,"I think what Mr. Novins was referring to was not one of Senator Kennedy's speeches, but the Democratic platform, which did mention cutting the national debt.",False,False,False,False,[],False,[],False,,False,,False,[],"['kennedy', ""'s speeches"", 'democratic platform', 'national debt']",[],[],deficit,['misc'],[]
282,0.08333333333333333,0.6666666666666666,,nixon,Nixon,"I think, too, that it should be pointed out that of course it is not possible, particularly under the proposals that Senator Kennedy has advocated, either to cut the national debt or to reduce taxes.",False,False,True,False,[],False,[],False,,False,,True,['kennedy'],"['kennedy', 'national debt']",[],[],taxes,['taxes'],[]
283,0.0,1.0,,nixon,Nixon,As a matter of fact it will be necessary to raise taxes.,False,False,False,False,[],False,[],False,,False,,False,[],[],[],[],taxes,['taxes'],[]
284,0.008333333333333333,0.36666666666666664,,nixon,Nixon,As Senator Kennedy points out that as far as his one proposal is concerned - the one for medical care for the aged - that that would be financed out of Social Security.,False,False,True,False,[],False,[],False,,False,,True,['kennedy'],"['kennedy', 'medical care', 'social security']",[],[],healthcare,['misc'],[]
285,0.03333333333333333,0.06666666666666667,,nixon,Nixon,"That, however, is raising taxes for those who pay Social Security.",False,False,False,False,[],False,[],False,,False,,False,[],['social security'],[],[],taxes,['taxes'],[]
286,0.1,0.4,,nixon,Nixon,He points out that he would make pay-as-you-go be the basis for our natural resources development.,False,False,False,False,[],False,[],False,,False,,False,[],['natural resources development'],[],[],economy,['misc'],[]
