index,polarity,subjectivity,timestamp,speaker,speaker_name,text,applause,laughter,interaction,attack,attack_target,agree,agree_target,interruption,interrupt_target,defense,defense_against,reference,mentions,noun_phrases,people,locations,topic,autotopic,first_mention
0,0.7,0.6000000000000001,,moderator,Moderator,Good evening.,False,False,False,False,[],False,[],False,,False,,False,[],['good evening'],[],[],introduction,['misc'],[]
1,0.215625,0.5,,moderator,Moderator,The television and radio stations of the United States and their affiliated stations are proud to provide facilities for a discussion of issues in the current political campaign by the two major candidates for the presidency.,False,False,False,False,[],False,[],False,,False,,False,[],"['radio stations', 'current political campaign', 'major candidates']",[],[],introduction,['misc'],[]
2,0.0,0.0,,moderator,Moderator,The candidates need no introduction.,False,False,False,False,[],False,[],False,,False,,False,[],['candidates need'],[],[],introduction,['misc'],[]
3,0.0,0.0,,moderator,Moderator,"The Republican candidate, Vice President Richard M. Nixon, and the Democratic candidate, Senator John F. Kennedy.",False,False,False,False,[],False,[],False,,False,,True,"['nixon', 'kennedy']","['republican', 'vice president', 'richard m. nixon', 'democratic candidate', 'john f. kennedy']",[],[],introduction,['misc'],[]
4,-0.4,0.6,,moderator,Moderator,"According to rules set by the candidates themselves, each man shall make an opening statement of approximately eight minutes' duration and a closing statement of approximately three minutes' duration.",False,False,False,False,[],False,[],False,,False,,False,[],"['according', 'opening statement']",[],[],introduction,['misc'],[]
5,0.0,0.0,,moderator,Moderator,"In between the candidates will answer, or comment upon answers to questions put by a panel of correspondents.",False,False,False,False,[],False,[],False,,False,,False,[],[],[],[],introduction,['misc'],[]
6,0.0625,0.10833333333333334,,moderator,Moderator,"In this, the first discussion in a series of four uh - joint appearances, the subject-matter has been agreed, will be restricted to internal or domestic American matters.",False,False,False,False,[],False,[],False,,False,,False,[],"['joint appearances', 'domestic american matters']",[],[],introduction,['misc'],[]
7,0.25,0.3333333333333333,,moderator,Moderator,And now for the first opening statement by Senator John F. Kennedy.,False,False,False,False,[],False,[],False,,False,,True,['kennedy'],['john f. kennedy'],[],[],question,['misc'],[]
8,0.0,0.0,,kennedy,Kennedy,"Mr. Smith, Mr. Nixon.",False,False,True,False,[],False,[],False,,False,,True,['nixon'],[],[],[],nixon,['misc'],[]
9,0.0,0.0,,kennedy,Kennedy,"In the election of 1860, Abraham Lincoln said the question was whether this nation could exist half-slave or half-free.",False,False,False,False,[],False,[],False,,False,,False,[],['abraham lincoln'],[],[],"lincoln, slavery",['misc'],[]
10,0.0,0.0,,kennedy,Kennedy,"In the election of 1960, and with the world around us, the question is whether the world will exist half-slave or half-free, whether it will move in the direction of freedom, in the direction of the road that we are taking, or whether it will move in the direction of slavery.",False,False,False,False,[],False,[],False,,False,,False,[],[],[],[],"slavery, freedom",['misc'],[]
11,0.6666666666666666,0.85,,kennedy,Kennedy,"I think it will depend in great measure upon what we do here in the United States, on the kind of society that we build, on the kind of strength that we maintain.",False,False,False,False,[],False,[],False,,False,,False,[],['great measure'],[],[],america,['misc'],[]
12,0.05,0.25,,kennedy,Kennedy,"We discuss tonight domestic issues, but I would not want that to be any implication to be given that this does not involve directly our struggle with Mr. Khrushchev for survival.",False,False,False,False,[],False,[],False,,False,,False,[],['domestic issues'],[],[],nikita,['misc'],[]
13,0.11688311688311688,0.29437229437229434,,kennedy,Kennedy,"Mr. Khrushchev is in New York, and he maintains the Communist offensive throughout the world because of the productive power of the Soviet Union itselF. The Chinese Communists have always had a large population.",False,False,False,False,[],False,[],False,,False,,False,[],"['york', 'productive power', 'soviet union itself', 'large population']",[],[],"nikita, china",['misc'],[]
14,0.115625,0.85,,kennedy,Kennedy,But they are important and dangerous now because they are mounting a major effort within their own country.,False,False,False,False,[],False,[],False,,False,,False,[],"['major effort', 'own country']",[],[],china,['misc'],[]
15,0.6,0.9,,kennedy,Kennedy,"The kind of country we have here, the kind of society we have, the kind of strength we build in the United States will be the defense of freedom.",False,False,False,False,[],False,[],False,,False,,False,[],[],[],[],"america, freedom",['misc'],[]
16,0.4,0.6,,kennedy,Kennedy,"If we do well here, if we meet our obligations, if we're moving ahead, then I think freedom will be secure around the world.",False,False,False,False,[],False,[],False,,False,,False,[],[],[],[],freedom,['misc'],[]
17,-0.5,0.29999999999999993,,kennedy,Kennedy,"If we fail, then freedom fails.",False,False,False,False,[],False,[],False,,False,,False,[],[],[],[],freedom,['misc'],[]
18,0.11833333333333335,0.458125,,kennedy,Kennedy,"Therefore, I think the question before the American people is: Are we doing as much as we can do? Are we as strong as we should be? Are we as strong as we must be if we're going to maintain our independence, and if we're going to maintain and hold out the hand of friendship to those who look to us for assistance, to those who look to us for survival? I should make it very clear that I do not think we're doing enough, that I am not satisfied as an American with the progress that we're making.",False,False,False,False,[],False,[],False,,False,,False,[],"['american people', ""'re making""]",[],[],economy,['misc'],[]
19,0.48,0.75,,kennedy,Kennedy,"This is a great country, but I think it could be a greater country; and this is a powerful country, but I think it could be a more powerful country.",False,False,False,False,[],False,[],False,,False,,False,[],"['great country', 'powerful country', 'powerful country']",[],[],america,['misc'],[]
20,-0.25,1.0,,kennedy,Kennedy,I'm not satisfied to have fifty percent of our steel-mill capacity unused.,False,False,False,False,[],False,[],False,,False,,False,[],['steel-mill capacity'],[],[],"steel, economy",['misc'],[]
21,0.0031250000000000028,0.44166666666666665,,kennedy,Kennedy,I'm not satisfied when the United States had last year the lowest rate of economic growth of any major industrialized society in the world.,False,False,False,False,[],False,[],False,,False,,False,[],['economic growth'],[],[],economy,['misc'],[]
22,0.39999999999999997,0.48333333333333334,,kennedy,Kennedy,Because economic growth means strength and vitality; it means we're able to sustain our defenses; it means we're able to meet our commitments abroad.,False,False,False,False,[],False,[],False,,False,,False,[],['economic growth'],[],[],"economy, trade",['misc'],[]
23,0.016666666666666663,0.5,,kennedy,Kennedy,"I'm not satisfied when we have over nine billion dollars worth of food - some of it rotting - even though there is a hungry world, and even though four million Americans wait every month for a food package from the government, which averages five cents a day per individual.",False,False,False,False,[],False,[],False,,False,,False,[],"['dollars worth', 'hungry world', 'food package']",[],[],food,['misc'],[]
24,0.0,0.0,,kennedy,Kennedy,"I saw cases in West Virginia, here in the United States, where children took home part of their school lunch in order to feed their families because I don't think we're meeting our obligations toward these Americans.",False,False,False,False,[],False,[],False,,False,,False,[],"['virginia', 'school lunch', ""'re meeting""]",[],[],children,['foreign-policy'],['foreign-policy']
25,0.125,0.75,,kennedy,Kennedy,I'm not satisfied when the Soviet Union is turning out twice as many scientists and engineers as we are.,False,False,False,False,[],False,[],False,,False,,False,[],['soviet union'],[],[],soviet,['misc'],[]
26,0.125,0.75,,kennedy,Kennedy,"I'm not satisfied when many of our teachers are inadequately paid, or when our children go to school part-time shifts.",False,False,False,False,[],False,[],False,,False,,False,[],['part-time shifts'],[],[],"education, jobs",['misc'],[]
27,0.125,0.125,,kennedy,Kennedy,I think we should have an educational system second to none.,False,False,False,False,[],False,[],False,,False,,False,[],['educational system'],[],[],education,['education'],['education']
28,0.07500000000000001,0.9,,kennedy,Kennedy,I'm not satisfied when I see men like Jimmy Hoffa - in charge of the largest union in the United States - still free.,False,False,False,False,[],False,[],False,,False,,False,[],['jimmy hoffa'],[],[],economy,['misc'],[]
29,-0.075,0.7,,kennedy,Kennedy,I'm not satisfied when we are failing to develop the natural resources of the United States to the fullest.,False,False,False,False,[],False,[],False,,False,,False,[],['natural resources'],[],[],economy,['misc'],[]
30,0.195,0.43499999999999994,,kennedy,Kennedy,"Here in the United States, which developed the Tennessee Valley and which built the Grand Coulee and the other dams in the Northwest United States at the present rate of hydropower production - and that is the hallmark of an industrialized society - the Soviet Union by 1975 will be producing more power than we are.",False,False,False,False,[],False,[],False,,False,,False,[],"['tennessee', 'coulee', 'present rate', 'hydropower production', 'soviet union']",[],[],c-energy,['misc'],[]
31,0.060416666666666646,0.7104166666666667,,kennedy,Kennedy,"These are all the things, I think, in this country that can make our society strong, or can mean that it stands still.",False,False,False,False,[],False,[],False,,False,,False,[],[],[],[],america,['misc'],[]
32,0.033333333333333326,0.5166666666666667,,kennedy,Kennedy,I'm not satisfied until every American enjoys his full constitutional rights.,False,False,False,False,[],False,[],False,,False,,False,[],['full constitutional rights'],[],[],justice,['misc'],[]
33,0.17750000000000002,0.34750000000000003,,kennedy,Kennedy,If a Negro baby is born - and this is true also of Puerto Ricans and Mexicans in some of our cities - he has about one-half as much chance to get through high school as a white baby.,False,False,False,False,[],False,[],False,,False,,False,[],"['negro', 'puerto ricans', 'mexicans', 'high school', 'white baby']",[],[],"racism, education",['misc'],[]
34,0.1,0.1,,kennedy,Kennedy,He has one-third as much chance to get through college as a white student.,False,False,False,False,[],False,[],False,,False,,False,[],['white student'],[],[],"racism, education",['misc'],[]
35,0.15555555555555556,0.2777777777777778,,kennedy,Kennedy,"He has about a third as much chance to be a professional man, about half as much chance to own a house.",False,False,False,False,[],False,[],False,,False,,False,[],['professional man'],[],[],racism,['misc'],[]
36,0.1,0.1,,kennedy,Kennedy,He has about uh - four times as much chance that he'll be out of work in his life as the white baby.,False,False,False,False,[],False,[],False,,False,,False,[],['white baby'],[],[],racism,['misc'],[]
37,0.5,0.5,,kennedy,Kennedy,I think we can do better.,False,False,False,False,[],False,[],False,,False,,False,[],[],[],[],misc,['misc'],[]
38,-0.1,0.0,,kennedy,Kennedy,I don't want the talents of any American to go to waste.,False,False,False,False,[],False,[],False,,False,,False,[],[],[],[],misc,['misc'],[]
39,0.0,0.0,,kennedy,Kennedy,I know that there are those who want to turn everything over to the government.,False,False,False,False,[],False,[],False,,False,,False,[],[],[],[],misc,['misc'],[]
40,0.0,0.0,,kennedy,Kennedy,I don't at all.,False,False,False,False,[],False,[],False,,False,,False,[],[],[],[],misc,['misc'],[]
41,0.0,0.0,,kennedy,Kennedy,I want the individuals to meet their responsibilities.,False,False,False,False,[],False,[],False,,False,,False,[],[],[],[],misc,['misc'],[]
42,0.0,0.0,,kennedy,Kennedy,And I want the states to meet their responsibilities.,False,False,False,False,[],False,[],False,,False,,False,[],[],[],[],misc,['misc'],[]
43,0.0,0.0,,kennedy,Kennedy,But I think there is also a national responsibility.,False,False,False,False,[],False,[],False,,False,,False,[],['national responsibility'],[],[],america,['misc'],[]
44,0.016666666666666666,0.06666666666666667,,kennedy,Kennedy,The argument has been used against every piece of social legislation in the last twenty-five years.,False,False,False,False,[],False,[],False,,False,,False,[],"['social legislation', 'twenty-five years']",[],[],racism,['misc'],[]
45,0.05,0.35,,kennedy,Kennedy,The people of the United States individually could not have developed the Tennessee Valley; collectively they could have.,False,False,False,False,[],False,[],False,,False,,False,[],['tennessee'],[],[],america,['misc'],[]
46,0.6,0.8,,kennedy,Kennedy,"A cotton farmer in Georgia or a peanut farmer or a dairy farmer in Wisconsin and Minnesota, he cannot protect himself against the forces of supply and demand in the market place; but working together in effective governmental programs he can do so.",False,False,False,False,[],False,[],False,,False,,False,[],"['cotton farmer', 'georgia', 'peanut farmer', 'dairy farmer', 'wisconsin', 'minnesota', 'market place', 'effective governmental programs']",[],[],economy,['misc'],[]
47,-0.03282828282828283,0.3430555555555556,,kennedy,Kennedy,"Seventeen million Americans, who live over sixty-five on an average Social Security check of about seventy-eight dollars a month, they're not able to sustain themselves individually, but they can sustain themselves through the social security system.",False,False,False,False,[],False,[],False,,False,,False,[],"['average social security check', 'seventy-eight dollars', 'social security system']",[],[],social,['misc'],[]
48,0.2333333333333333,0.3333333333333333,,kennedy,Kennedy,"I don't believe in big government, but I believe in effective governmental action.",False,False,False,False,[],False,[],False,,False,,False,[],"['big government', 'effective governmental action']",[],[],misc,['misc'],[]
49,0.0,1.0,,kennedy,Kennedy,And I think that's the only way that the United States is going to maintain its freedom.,False,False,False,False,[],False,[],False,,False,,False,[],[],[],[],freedom,['misc'],[]
50,0.0,1.0,,kennedy,Kennedy,It's the only way that we're going to move ahead.,False,False,False,False,[],False,[],False,,False,,False,[],[],[],[],misc,['misc'],[]
51,0.5,0.5,,kennedy,Kennedy,I think we can do a better job.,False,False,False,False,[],False,[],False,,False,,False,[],[],[],[],misc,['misc'],[]
52,0.5,0.5,,kennedy,Kennedy,I think we're going to have to do a better job if we are going to meet the responsibilities which time and events have placed upon us.,False,False,False,False,[],False,[],False,,False,,False,[],[],[],[],misc,['misc'],[]
53,0.0,0.0,,kennedy,Kennedy,We cannot turn the job over to anyone else.,False,False,False,False,[],False,[],False,,False,,False,[],[],[],[],misc,['misc'],[]
54,-0.26666666666666666,0.3333333333333333,,kennedy,Kennedy,"If the United States fails, then the whole cause of freedom fails.",False,False,False,False,[],False,[],False,,False,,False,[],[],[],[],freedom,['misc'],[]
55,0.8,0.75,,kennedy,Kennedy,And I think it depends in great measure on what we do here in this country.,False,False,False,False,[],False,[],False,,False,,False,[],['great measure'],[],[],america,['misc'],[]
56,0.7,0.6000000000000001,,kennedy,Kennedy,The reason Franklin Roosevelt was a good neighbor in Latin America was because he was a good neighbor in the United States.,False,False,False,False,[],False,[],False,,False,,False,[],"['franklin roosevelt', 'good neighbor', 'america', 'good neighbor']",[],[],roosevelt,['misc'],[]
57,0.0,0.0,,kennedy,Kennedy,Because they felt that the American society was moving again.,False,False,False,False,[],False,[],False,,False,,False,[],['american society'],[],[],america,['misc'],[]
58,0.0,0.0,,kennedy,Kennedy,I want us to recapture that image.,False,False,False,False,[],False,[],False,,False,,False,[],[],[],[],misc,['misc'],[]
59,0.0,0.0,,kennedy,Kennedy,"I want people in Latin America and Africa and Asia to start to look to America; to see how we're doing things; to wonder what the resident of the United States is doing; and not to look at Khrushchev, or look at the Chinese Communists.",False,False,False,False,[],False,[],False,,False,,False,[],"['america', 'africa', 'asia', 'america', 'khrushchev']",[],[],"nikita, china",['misc'],[]
60,0.0,0.0,,kennedy,Kennedy,That is the obligation upon our generation.,False,False,False,False,[],False,[],False,,False,,False,[],[],[],[],misc,['misc'],[]
61,0.0,0.0,,kennedy,Kennedy,"In 1933, Franklin Roosevelt said in his inaugural that this generation of Americans has a rendezvous with destiny.",False,False,False,False,[],False,[],False,,False,,False,[],['franklin roosevelt'],[],[],roosevelt,['misc'],[]
62,0.0,0.125,,kennedy,Kennedy,I think our generation of Americans has the same rendezvous.,False,False,False,False,[],False,[],False,,False,,False,[],[],[],[],misc,['misc'],[]
63,0.5,0.5,,kennedy,Kennedy,The question now is: Can freedom be maintained under the most severe tack - attack it has ever known? I think it can be.,False,False,False,False,[],False,[],False,,False,,False,[],['severe tack'],[],[],misc,['misc'],[]
64,0.0,1.0,,kennedy,Kennedy,And I think in the final analysis it depends upon what we do here.,False,False,False,False,[],False,[],False,,False,,False,[],['final analysis'],[],[],misc,['misc'],[]
65,0.0,0.0,,kennedy,Kennedy,I think it's time America started moving again.,False,False,False,False,[],False,[],False,,False,,False,[],"[""'s time"", 'america']",[],[],america,['misc'],[]
66,0.0,0.0,,moderator,Moderator,And now the opening statement by Vice President Richard M. Nixon,False,False,False,False,[],False,[],False,,False,,True,['nixon'],"['opening statement', 'vice president', 'richard m. nixon']",[],[],question,['misc'],[]
67,0.0,0.0,,nixon,Nixon,"Mr. Smith, Senator Kennedy.",False,False,True,False,[],False,[],False,,False,,True,['kennedy'],['kennedy'],[],[],kennedy,['misc'],[]
68,0.5,0.5,,nixon,Nixon,The things that Senator Kennedy has said many of us can agree with.,False,False,True,False,[],False,[],False,,False,,True,['kennedy'],['kennedy'],[],[],kennedy,['misc'],[]
69,0.1111111111111111,0.3333333333333333,,nixon,Nixon,There is no question but that we cannot discuss our internal affairs in the United States without recognizing that they have a tremendous bearing on our international position.,False,False,False,False,[],False,[],False,,False,,False,[],"['internal affairs', 'international position']",[],[],"america, trade",['misc'],[]
70,-0.1,0.7,,nixon,Nixon,"There is no question but that this nation cannot stand still; because we are in a deadly competition, a competition not only with the men in the Kremlin, but the men in Peking.",False,False,False,False,[],False,[],False,,False,,False,[],"['kremlin', 'peking']",[],[],"soviet, china",['misc'],[]
71,0.0,0.0,,nixon,Nixon,"We're ahead in this competition, as Senator Kennedy, I think, has implied.",False,False,True,False,[],False,[],False,,False,,True,['kennedy'],['kennedy'],[],[],kennedy,['misc'],[]
72,0.0,1.0,,nixon,Nixon,"But when you're in a race, the only way to stay ahead is to move ahead.",False,False,False,False,[],False,[],False,,False,,False,[],[],[],[],misc,['misc'],[]
73,0.1,0.4,,nixon,Nixon,"And I subscribe completely to the spirit that Senator Kennedy has expressed tonight, the spirit that the United States should move ahead.",False,False,True,False,[],False,[],False,,False,,True,['kennedy'],['kennedy'],[],[],america,['misc'],[]
74,0.5,0.5,,nixon,Nixon,"Where, then, do we disagree? I think we disagree on the implication of his remarks tonight and on the statements that he has made on many occasions during his campaign to the effect that the United States has been standing still.",False,False,False,False,[],False,[],False,,False,,False,[],[],[],[],america,['misc'],[]
75,0.0,0.06666666666666667,,nixon,Nixon,"We heard tonight, for example, the statement made that our growth in national product last year was the lowest of any industrial nation in the world.",False,False,False,False,[],False,[],False,,False,,False,[],"['national product', 'industrial nation']",[],[],economy,['misc'],[]
76,0.0,0.06666666666666667,,nixon,Nixon,"Now last year, of course, was 1958.",False,False,False,False,[],False,[],False,,False,,False,[],[],[],[],misc,['misc'],[]
77,0.0,0.0,,nixon,Nixon,That happened to be a recession year.,False,False,False,False,[],False,[],False,,False,,False,[],['recession year'],[],[],economy,['misc'],[]
78,0.0,0.0,,nixon,Nixon,But when we look at the growth of G.N.P.,False,False,False,False,[],False,[],False,,False,,False,[],['g.n.p'],[],[],economy,['misc'],[]
79,0.0,0.0,,nixon,Nixon,"this year, a year of recovery, we find that it's six and nine-tenths per cent and one of the highest in the world today.",False,False,False,False,[],False,[],False,,False,,False,[],[],[],[],economy,['misc'],[]
80,0.25,0.25,,nixon,Nixon,More about that later.,False,False,False,False,[],False,[],False,,False,,False,[],[],[],[],misc,['misc'],[]
81,0.65,1.0,,nixon,Nixon,"Looking then to this problem of how the United States should move ahead and where the United States is moving, I think it is well that we take the advice of a very famous campaigner: Let's look at the record.",False,False,False,False,[],False,[],False,,False,,False,[],"['looking', 'famous campaigner']",[],[],misc,['misc'],[]
82,0.26666666666666666,0.7666666666666666,,nixon,Nixon,"Is the United States standing still? Is it true that this Administration, as Senator Kennedy has charged, has been an Administration of retreat, of defeat, of stagnation? Is it true that, as far as this country is concerned, in the field of electric power, in all of the fields that he has mentioned, we have not been moving ahead.",False,False,True,False,[],False,[],False,,False,,True,['kennedy'],"['kennedy', 'electric power']",[],[],kennedy,['misc'],[]
83,0.0,0.0,,nixon,Nixon,"Well, we have a comparison that we can make.",False,False,False,False,[],False,[],False,,False,,False,[],[],[],[],misc,['misc'],[]
84,-0.16666666666666666,0.16666666666666666,,nixon,Nixon,We have the record of the Truman Administration of seven and a half years and the seven and a half years of the Eisenhower Administration.,False,False,False,False,[],False,[],False,,False,,False,[],"['truman', 'eisenhower']",[],[],misc,['misc'],[]
85,0.0,0.0,,nixon,Nixon,"When we compare these two records in the areas that Senator Kennedy has - has discussed tonight, I think we find that America has been moving ahead.",False,False,True,False,[],False,[],False,,False,,True,['kennedy'],"['kennedy', 'america']",[],[],kennedy,['misc'],[]
86,0.0,0.0,,nixon,Nixon,Let's take schools.,False,False,False,False,[],False,[],False,,False,,False,[],[],[],[],education,['misc'],[]
87,-0.027777777777777766,0.20555555555555557,,nixon,Nixon,"We have built more schools in these last seven and a half years than we built in the previous seven and a half, for that matter in the previous twenty years.",False,False,False,False,[],False,[],False,,False,,False,[],[],[],[],education,['misc'],[]
88,0.0,0.0,,nixon,Nixon,Let's take hydroelectric power.,False,False,False,False,[],False,[],False,,False,,False,[],['hydroelectric power'],[],[],c-energy,['misc'],[]
89,0.07333333333333333,0.2866666666666667,,nixon,Nixon,We have developed more hydroelectric power in these seven and a half years than was developed in any previous administration in history.,False,False,False,False,[],False,[],False,,False,,False,[],"['hydroelectric power', 'previous administration']",[],[],c-energy,['misc'],[]
90,0.0,0.0,,nixon,Nixon,Let us take hospitals.,False,False,False,False,[],False,[],False,,False,,False,[],[],[],[],healthcare,['misc'],[]
91,0.16666666666666669,0.3333333333333333,,nixon,Nixon,We find that more have been built in this Administration than in the previous Administration.,False,False,False,False,[],False,[],False,,False,,False,[],['previous administration'],[],[],healthcare,['misc'],[]
92,0.175,0.3875,,nixon,Nixon,The same is true of highways.,False,False,False,False,[],False,[],False,,False,,False,[],[],[],[],economy,['misc'],[]
93,0.0,0.0,,nixon,Nixon,Let's put it in terms that all of us can understand.,False,False,False,False,[],False,[],False,,False,,False,[],[],[],[],misc,['misc'],[]
94,-0.041666666666666664,0.41666666666666663,,nixon,Nixon,We often hear gross national product discussed and in that respect may I say that when we compare the growth in this Administration with that of the previous Administration that then there was a total growth of eleven percent over seven years; in this Administration there has been a total growth of nineteen per cent over seven years.,False,False,False,False,[],False,[],False,,False,,False,[],"['gross national product', 'previous administration', 'total growth', 'total growth']",[],[],economy,['misc'],[]
95,0.5,0.5,,nixon,Nixon,That shows that there's been more growth in this Administration than in its predecessor.,False,False,False,False,[],False,[],False,,False,,False,[],[],[],[],economy,['misc'],[]
96,-0.15,0.39999999999999997,,nixon,Nixon,But let's not put it there; let's put it in terms of the average family.,False,False,False,False,[],False,[],False,,False,,False,[],['average family'],[],[],misc,['misc'],[]
