index,speaker_name,speaker,topic,text
0,KELLY,KELLY,uncategorized,"It is nine p.m. on the East Coast, and the moment of truth has arrived."
1,KELLY,KELLY,uncategorized,"Welcome to the first debate night of the 2016 presidential campaign, live from Quicken Loans Arena in Cleveland, Ohio."
2,KELLY,KELLY,uncategorized,I’m Megyn Kelly…
3,KELLY,KELLY,uncategorized,(APPLAUSE)
4,KELLY,KELLY,uncategorized,"… along with my co-moderators, Brett Baier and Chris Wallace."
5,KELLY,KELLY,uncategorized,Tonight…
6,KELLY,KELLY,uncategorized,(APPLAUSE)
7,KELLY,KELLY,uncategorized,Nice.
8,KELLY,KELLY,uncategorized,"Tonight, thousands of people here in the Q, along with millions of voters at home will get their very first chance to see the candidates face off in a debate, answering the questions you want answered."
9,BAIER,BAIER,uncategorized,"Less than a year from now, in this very arena, one of these 10 candidates or one of the seven on the previous debate tonight will accept the Republican party’s nomination."
10,BAIER,BAIER,uncategorized,(APPLAUSE)
11,BAIER,BAIER,uncategorized,"Tonight’s candidates were selected based on an average of five national polls. Just a few hours ago, you heard from the candidates ranked 11th through 17. And now, the prime-time event, the top 10."
12,WALLACE,WALLACE,uncategorized,"Also of note, Fox News is partnering for tonight’s debate with Facebook. For the past several weeks, we’ve been asking you for questions for the candidates on Facebook. Nearly 6 million of you, 6 million, viewed the debate videos on our site, and more than 40,000 of you submitted questions some of which you will hear us asking the candidates tonight."
13,KELLY,KELLY,uncategorized,As for the candidates who will be answering those questions? Here they are.
14,KELLY,KELLY,uncategorized,"Positioned on the stage by how they stand in the polls, in the center of the stage tonight, businessman Donald Trump."
15,KELLY,KELLY,uncategorized,(APPLAUSE)
16,KELLY,KELLY,uncategorized,Former Florida Governor Jeb Bush.
17,KELLY,KELLY,uncategorized,(APPLAUSE)
18,KELLY,KELLY,uncategorized,Wisconsin Governor Scott Walker.
19,KELLY,KELLY,uncategorized,(APPLAUSE)
20,KELLY,KELLY,uncategorized,Former Arkansas Governor Mike Huckabee.
21,KELLY,KELLY,uncategorized,(APPLAUSE)
22,BAIER,BAIER,uncategorized,"Neurosurgeon, Dr. Ben Carson."
23,BAIER,BAIER,uncategorized,(APPLAUSE)
24,BAIER,BAIER,uncategorized,Texas Senator Ted Cruz.
25,BAIER,BAIER,uncategorized,(APPLAUSE)
26,BAIER,BAIER,uncategorized,Florida Senator Marco Rubio.
27,BAIER,BAIER,uncategorized,(APPLAUSE)
28,WALLACE,WALLACE,uncategorized,Kentucky Senator Rand Paul.
29,WALLACE,WALLACE,uncategorized,(APPLAUSE)
30,WALLACE,WALLACE,uncategorized,New Jersey Governor Chris Christie.
31,WALLACE,WALLACE,uncategorized,(APPLAUSE) And your very own governor of Ohio…
32,WALLACE,WALLACE,uncategorized,(APPLAUSE)
33,WALLACE,WALLACE,uncategorized,… John Kasich.
34,WALLACE,WALLACE,uncategorized,(APPLAUSE)
35,WALLACE,WALLACE,uncategorized,"Brett — Brett, I think you would call that a home field advantage."
36,BAIER,BAIER,uncategorized,It might be. It might be. We’ll see.
37,(UNKNOWN),(UNKNOWN),uncategorized,Is this in the rules? An objection’s coming.
38,BAIER,BAIER,uncategorized,"It might be. The rules for tonight are simple. One minute for answers, 30 seconds for follow-ups. And if a candidate runs over, you’ll hear this."
39,BAIER,BAIER,uncategorized,"Pleasant, no?"
40,BAIER,BAIER,uncategorized,"We also have a big crowd here with us tonight in the home of the Cavaliers, as I mentioned."
41,BAIER,BAIER,uncategorized,And while we expect them…
42,BAIER,BAIER,uncategorized,(APPLAUSE)
43,BAIER,BAIER,uncategorized,"… we expect them to be enthusiastic, as you heard, we don’t want to take anything away from the valuable time for the candidate. So, we’re looking for somewhere between a reaction to a LeBron James dunk and the Cleveland Public Library across the street."
44,BAIER,BAIER,uncategorized,(LAUGHTER)
45,BAIER,BAIER,uncategorized,"Somewhere there, we’ll find a balance tonight."
46,BAIER,BAIER,uncategorized,"Without further ado, let’s begin."
47,BAIER,BAIER,uncategorized,"Gentlemen, we know how much you love hand-raising questions. So we promise, this is the only one tonight the only one. Is there anyone on stage, and can I see hands, who is unwilling tonight to pledge your support to the eventual nominee of the Republican party and pledge to not run an independent campaign against that person."
48,BAIER,BAIER,uncategorized,"Again, we’re looking for you to raise your hand now — raise your hand now if you won’t make that pledge tonight."
49,BAIER,BAIER,uncategorized,Mr. Trump.
50,BAIER,BAIER,uncategorized,(BOOING)
51,BAIER,BAIER,uncategorized,"Mr. Trump to be clear, you’re standing on a Republican primary debate stage."
52,TRUMP,TRUMP,uncategorized,I fully understand.
53,BAIER,BAIER,uncategorized,The place where the RNC will give the nominee the nod.
54,TRUMP,TRUMP,uncategorized,I fully understand.
55,BAIER,BAIER,uncategorized,And that experts say an independent run would almost certainly hand the race over to Democrats and likely another Clinton.
56,BAIER,BAIER,uncategorized,You can’t say tonight that you can make that pledge?
57,TRUMP,TRUMP,uncategorized,"I cannot say. I have to respect the person that, if it’s not me, the person that wins, if I do win, and I’m leading by quite a bit, that’s what I want to do. I can totally make that pledge. If I’m the nominee, I will pledge I will not run as an independent. But — and I am discussing it with everybody, but I’m, you know, talking about a lot of leverage. We want to win, and we will win. But I want to win as the Republican. I want to run as the Republican nominee."
58,BAIER,BAIER,uncategorized,"So tonight, you can’t say if another one of these…"
59,PAUL,PAUL,uncategorized,This is what’s wrong!
60,BAIER,BAIER,uncategorized,OK.
61,PAUL,PAUL,uncategorized,"I mean, this is what’s wrong. He buys and sells politicians of all stripes, he’s already…"
62,BAIER,BAIER,uncategorized,Dr. Paul.
63,PAUL,PAUL,uncategorized,"Hey, look, look! He’s already hedging his bet on the Clintons, OK? So if he doesn’t run as a Republican, maybe he supports Clinton, or maybe he runs as an independent…"
64,BAIER,BAIER,uncategorized,OK.
65,PAUL,PAUL,uncategorized,…but I’d say that he’s already hedging his bets because he’s used to buying politicians.
66,TRUMP,TRUMP,uncategorized,"Well, I’ve given him plenty of money."
67,BAIER,BAIER,uncategorized,"Just to be clear, you can’t make a — we’re gonna — we’re going to move on."
68,BAIER,BAIER,uncategorized,You’re not gonna make the pledge tonight?
69,TRUMP,TRUMP,uncategorized,I will not make the pledge at this time.
70,BAIER,BAIER,uncategorized,OK. Alright.
71,BAIER,BAIER,uncategorized,"(LAUGHTER, BOOING)"
72,KELLY,KELLY,uncategorized,"Gentlemen, our first round of questions is on the subject of electability in the general election, and we start tonight with you, Dr. Carson."
73,KELLY,KELLY,uncategorized,"You are a successful neurosurgeon, but you admit that you have had to study up on foreign policy, saying there’s a lot to learn."
74,KELLY,KELLY,uncategorized,"Your critics say that your inexperience shows. You’ve suggested that the Baltic States are not a part of NATO, just months ago you were unfamiliar with the major political parties and government in Israel, and domestically, you thought Alan Greenspan had been treasury secretary instead of federal reserve chair."
75,KELLY,KELLY,uncategorized,"Aren’t these basic mistakes, and don’t they raise legitimate questions about whether you are ready to be president?"
76,CARSON,CARSON,uncategorized,"Well, I could take issue with — with all of those things, but we don’t have time."
77,CARSON,CARSON,uncategorized,"But I will say, we have a debate here tonight, and we will have an opportunity to explore those areas, and I’m looking very much forward to demonstrating that, in fact, the thing that is probably most important is having a brain, and to be able to figure things out and learn things very rapidly."
78,CARSON,CARSON,uncategorized,"So, you know, experience comes from a large number of different arenas, and America became a great nation early on not because it was flooded with politicians, but because it was flooded with people who understood the value of personal responsibility, hard work, creativity, innovation, and that’s what will get us on the right track now, as well."
79,WALLACE,WALLACE,uncategorized,"Senator Rubio, when Jeb Bush announced his candidacy for presidency, he said this “There’s no passing off responsibility when you’re a governor, no blending into the legislative crowd.”"
80,WALLACE,WALLACE,uncategorized,"Could you please address Governor Bush across the stage here, and explain to him why you, someone who has never held executive office, are better prepared to be president than he is, a man who you say did a great job running your state of Florida for eight years."
81,RUBIO,RUBIO,uncategorized,"Well, thank you for the question, Chris, and it’s great to be here tonight. Let me begin by saying this I’m not new to the political process; I was making a contribution as the speaker of the third largest and most diverse state in the country well before I even got into the Senate."
82,RUBIO,RUBIO,uncategorized,"I would add to that that this election cannot be a resume competition. It’s important to be qualified, but if this election is a resume competition, then Hillary Clinton’s gonna be the next president, because she’s been in office and in government longer than anybody else running here tonight."
83,RUBIO,RUBIO,uncategorized,"Here’s what this election better be about: This election better be about the future, not the past. It better be about the issues our nation and the world is facing today, not simply the issues we once faced."
84,RUBIO,RUBIO,uncategorized,"This country is facing an economy that has been radically transformed. You know, the largest retailer in the country and the world today, Amazon, doesn’t even own a single store? And these changes have been disruptive. They have changed people’s lives. The jobs that once sustained our middle class, they either don’t pay enough or they are gone, and we need someone that understands that as our nominee."
85,RUBIO,RUBIO,uncategorized,"If I’m our nominee, how is Hillary Clinton gonna lecture me about living paycheck to paycheck? I was raised paycheck to paycheck. How is she — how is she gonna lecture me — how is she gonna lecture me about student loans? I owed over $100,000 just four years ago."
86,RUBIO,RUBIO,uncategorized,"If I’m our nominee, we will be the party of the future."
87,BAIER,BAIER,uncategorized,"Governor Bush, you have insisted that you’re your own man. You say you have a life experience uniquely your own. Not your father’s, not your brother’s."
88,BAIER,BAIER,uncategorized,"But there are several opponents on this stage who get big- applause lines in early voting states with this line: quote, “the last thing the country needs is another Bush in the Oval Office.”"
89,BAIER,BAIER,uncategorized,So do you understand the real concern in this country about dynastic politics?
90,BUSH,BUSH,uncategorized,"Absolutely, I do, and I’m gonna run hard, run with heart, and run to win."
91,BUSH,BUSH,uncategorized,I’m gonna have to earn this. Maybe the barrier — the bar’s even higher for me. That’s fine.
92,BUSH,BUSH,uncategorized,"I’ve got a record in Florida. I’m proud of my dad, and I’m certainly proud of my brother. In Florida, they called me Jeb, because I earned it."
93,BUSH,BUSH,uncategorized,"I cut taxes every year, totaling $19 billion. We were — we had — we balanced every budget. We went from $1 billion of reserves to $9 billion of reserves."
94,BUSH,BUSH,uncategorized,We were one of two states that went to AAA bond rating.
95,BUSH,BUSH,uncategorized,"They keep — they called me Veto Corleone. Because I vetoed 2,500 separate line-items in the budget."
96,BUSH,BUSH,uncategorized,(APPLAUSE)
97,BUSH,BUSH,uncategorized,"I am my own man. I governed as a conservative, and I govern effectively. And the net effect was, during my eight years, 1.3 million jobs were created. We left the state better off because I applied conservative principles in a purple state the right way, and people rose up."
98,BUSH,BUSH,uncategorized,(APPLAUSE)
99,KELLY,KELLY,uncategorized,"Mr. Trump, one of the things people love about you is you speak your mind and you don’t use a politician’s filter. However, that is not without its downsides, in particular, when it comes to women."
100,KELLY,KELLY,uncategorized,"You’ve called women you don’t like “fat pigs, dogs, slobs, and disgusting animals.”"
101,KELLY,KELLY,uncategorized,(LAUGHTER)
102,KELLY,KELLY,uncategorized,Your Twitter account…
103,TRUMP,TRUMP,uncategorized,Only Rosie O’Donnell.
104,TRUMP,TRUMP,uncategorized,(LAUGHTER)
105,KELLY,KELLY,uncategorized,"No, it wasn’t."
106,KELLY,KELLY,uncategorized,(APPLAUSE)
107,KELLY,KELLY,uncategorized,Your Twitter account…
108,KELLY,KELLY,uncategorized,(APPLAUSE)
109,TRUMP,TRUMP,uncategorized,Thank you.
110,KELLY,KELLY,uncategorized,"For the record, it was well beyond Rosie O’Donnell."
111,TRUMP,TRUMP,uncategorized,"Yes, I’m sure it was."
112,KELLY,KELLY,uncategorized,"Your Twitter account has several disparaging comments about women’s looks. You once told a contestant on Celebrity Apprentice it would be a pretty picture to see her on her knees. Does that sound to you like the temperament of a man we should elect as president, and how will you answer the charge from Hillary Clinton, who was likely to be the Democratic nominee, that you are part of the war on women?"
113,TRUMP,TRUMP,uncategorized,I think the big problem this country has is being politically correct.
114,TRUMP,TRUMP,uncategorized,(APPLAUSE)
115,TRUMP,TRUMP,uncategorized,"I’ve been challenged by so many people, and I don’t frankly have time for total political correctness. And to be honest with you, this country doesn’t have time either. This country is in big trouble. We don’t win anymore. We lose to China. We lose to Mexico both in trade and at the border. We lose to everybody."
116,TRUMP,TRUMP,uncategorized,"And frankly, what I say, and oftentimes it’s fun, it’s kidding. We have a good time. What I say is what I say. And honestly Megyn, if you don’t like it, I’m sorry. I’ve been very nice to you, although I could probably maybe not be, based on the way you have treated me. But I wouldn’t do that."
117,TRUMP,TRUMP,uncategorized,(APPLAUSE)
118,TRUMP,TRUMP,uncategorized,"But you know what, we — we need strength, we need energy, we need quickness and we need brain in this country to turn it around. That, I can tell you right now."
119,WALLACE,WALLACE,uncategorized,"Senator Cruz, your colleague, Senator Paul, right there next to you, said a few months ago he agrees with you on a number of issues, but he says you do nothing to grow the party. He says you feed red meat to the base, but you don’t reach out to minorities. You have a toxic relationship with GOP leaders in Congress. You even called the Republican Senate Leader Mitch McConnell a liar recently."
120,WALLACE,WALLACE,uncategorized,(APPLAUSE)
121,WALLACE,WALLACE,uncategorized,How can you win in 2016 when you’re such a divisive figure?
122,CRUZ,CRUZ,uncategorized,"Chris, I believe the American people are looking for someone to speak the truth."
123,CRUZ,CRUZ,uncategorized,(APPLAUSE)
124,CRUZ,CRUZ,uncategorized,"If you’re looking for someone to go to Washington, to go along to get along, to get — to agree with the career politicians in both parties who get in bed with the lobbyists and special interests, then I ain’t your guy."
125,CRUZ,CRUZ,uncategorized,There is a reason…
126,CRUZ,CRUZ,uncategorized,(APPLAUSE)
127,CRUZ,CRUZ,uncategorized,"…. that we have $18 trillion in debt. Because as conservatives, as Republicans, we keep winning elections. We got a Republican House, we’ve got a Republican Senate, and we don’t have leaders who honor their commitments. I will always tell the truth and do what I said I would do."
128,CRUZ,CRUZ,uncategorized,(APPLAUSE)
129,BAIER,BAIER,uncategorized,"Governor Christie, you’re not exactly the darling of conservatives. You tout your record as a Republican governor in a blue state. On Facebook, the most people talking about you, not surprisingly, come from your state of New Jersey, and one of the top issues they are talking about is the economy."
130,BAIER,BAIER,uncategorized,"This — this may be why. Under your watch, New Jersey has undergone nine credit rating downgrades. The state’s 44th in private sector growth. You face an employee pension crisis and the Garden State has the third highest foreclosure rate in the country. So why should voters believe that your management of the country’s finances would be any different?"
131,CHRISTIE,CHRISTIE,uncategorized,"If you think it’s bad now, you should’ve seen it when I got there."
132,CHRISTIE,CHRISTIE,uncategorized,(LAUGHTER)
133,CHRISTIE,CHRISTIE,uncategorized,(APPLAUSE)
134,CHRISTIE,CHRISTIE,uncategorized,"The fact is — the fact is, in the eight years before I became governor, taxes and fees were raised at the state level 115 times. In the eight years before I became governor, spending was increased 56 percent. And in the eight years before I become governor, taxes and fees were raised at the state level 115 times."
135,CHRISTIE,CHRISTIE,uncategorized,"In the eight years before I became Governor, spending was increased 56 percent, and in the eight years before I became governor, there was zero net private sector job growth in New Jersey. Zero. For eight years."
136,CHRISTIE,CHRISTIE,uncategorized,"So, what did we do? We came in, we balanced an $11 billion deficit on a $29 billion budget by cutting over 800 programs in the state budget. We brought the budget into balance with no tax increases. In fact, we vetoed five income tax increases during my time as governor. We cut business taxes $2.3 billion, and we cut regulation by one-third of what my predecessor put in place."
137,CHRISTIE,CHRISTIE,uncategorized,"And, what’s happened since? A hundred ninety-two thousand private sector jobs in the five and a half years I’ve been governor. We have a lot of work to do in New Jersey, but I am darn proud we’ve brought our state back."
138,CHRISTIE,CHRISTIE,uncategorized,(APPLAUSE)
139,KELLY,KELLY,uncategorized,"Governor Walker, you’ve consistently said that you want to make abortion illegal even in cases of rape, incest, or to save the life of the mother. You recently signed an abortion law in Wisconsin that does have an exception for the mother’s life, but you’re on the record as having objected to it. Would you really let a mother die rather than have an abortion, and with 83 percent of the American public in favor of a life exception, are you too out of the mainstream on this issue to win the general election?"
140,WALKER,WALKER,uncategorized,"Well, I’m pro-life, I’ve always been pro-life, and I’ve got a position that I think is consistent with many Americans out there in that…"
141,(APPLAUSE) WALKER,(APPLAUSE) WALKER,uncategorized,"…in that I believe that that is an unborn child that’s in need of protection out there, and I’ve said many a time that that unborn child can be protected, and there are many other alternatives that can also protect the life of that mother. That’s been consistently proven."
142,(APPLAUSE) WALKER,(APPLAUSE) WALKER,uncategorized,"Unlike Hillary Clinton, who has a radical position in terms of support for Planned Parenthood, I defunded Planned Parenthood more than four years ago, long before any of these videos came out…"
143,(APPLAUSE) WALKER,(APPLAUSE) WALKER,uncategorized,(APPLAUSE)
144,WALKER,WALKER,uncategorized,…I’ve got a position that’s in line with everyday America.
145,WALKER,WALKER,uncategorized,(APPLAUSE)
146,WALLACE,WALLACE,uncategorized,"Governor Huckabee, like Governor Walker, you have staked out strong positions on social issues. You favor a constitutional amendment banning same sex marriage. You favor a constitutional amendment banning abortions, except for the life of the mother. Millions of people in this country agree with you, but according to the polls, and again this an electability question, according to the polls, more people don’t, so how do you persuade enough Independents and Democrats to get elected in 2016?"
147,HUCKABEE,HUCKABEE,uncategorized,"Chris, I disagree with the idea that the real issue is a constitutional amendment. That’s a long and difficult process. I’ve actually taken the position that’s bolder than that."
148,HUCKABEE,HUCKABEE,uncategorized,"A lot of people are talking about defunding planned parenthood, as if that’s a huge game changer. I think it’s time to do something even more bold. I think the next president ought to invoke the Fifth, and Fourteenth Amendments to the constitution now that we clearly know that that baby inside the mother’s womb is a person at the moment of conception."
149,HUCKABEE,HUCKABEE,uncategorized,"The reason we know that it is is because of the DNA schedule that we now have clear scientific evidence on. And, this notion that we just continue to ignore the personhood of the individual is a violation of that unborn child’s Fifth and 14th Amendment rights for due process and equal protection under the law."
150,HUCKABEE,HUCKABEE,uncategorized,"It’s time that we recognize the Supreme Court is not the supreme being, and we change the policy to be pro-life and protect children instead of rip up their body parts and sell them like they’re parts to a Buick."
151,HUCKABEE,HUCKABEE,uncategorized,(APPLAUSE)
152,BAIER,BAIER,uncategorized,"Senator Paul, you recently blamed the rise of ISIS on Republican hawks. You later said that that statement, you could have said it better. But, the statement went on, and you said, quote, “Everything they’ve talked about in foreign policy, they’ve been wrong for the last 20 years.”"
153,BAIER,BAIER,uncategorized,Why are you so quick to blame your own party?
154,PAUL,PAUL,uncategorized,"First of all, only ISIS is responsible for the terrorism. Only ISIS is responsible for the depravity. But, we do have to examine, how are we going to defeat ISIS?"
155,PAUL,PAUL,uncategorized,I’ve got a proposal. I’m the leading voice in America for not arming the allies of ISIS.
156,PAUL,PAUL,uncategorized,(APPLAUSE)
157,PAUL,PAUL,uncategorized,"I’ve been fighting amidst a lot of opposition from both Hillary Clinton, as well as some Republicans who wanted to send arms to the allies of ISIS. ISIS rides around in a billion dollars worth of U.S. Humvees. It’s a disgrace. We’ve got to stop — we shouldn’t fund our enemies, for goodness sakes."
158,PAUL,PAUL,uncategorized,"So, we didn’t create ISIS — ISIS created themselves, but we will stop them, and one of the ways we stop them is by not funding them, and not arming them."
159,PAUL,PAUL,uncategorized,(APPLAUSE)
160,KELLY,KELLY,uncategorized,"Governor Kasich, You chose to expand Medicaid in your state, unlike several other governors on this stage tonight, and it is already over budget by some estimates costing taxpayers an additional $1.4 billion in just the first 18 months."
161,KELLY,KELLY,uncategorized,"You defended your Medicaid expansion by invoking God, saying to skeptics that when they arrive in heaven, Saint Peter isn’t going to ask them how small they’ve kept government, but what they have done for the poor."
162,KELLY,KELLY,uncategorized,"Why should Republican voters, who generally want to shrink government, believe that you won’t use your Saint Peter rationale to expand every government program?"
163,KASICH,KASICH,uncategorized,"Well, first of all…"
164,KASICH,KASICH,uncategorized,(APPLAUSE)
165,KASICH,KASICH,uncategorized,"— first of all, Megyn, you should know that — that President Reagan expanded Medicaid three or four times."
166,KASICH,KASICH,uncategorized,"Secondly, I had an opportunity to bring resources back to Ohio to do what?"
167,KASICH,KASICH,uncategorized,"To treat the mentally ill. Ten thousand of them sit in our prisons. It costs $22,500 a year…"
168,KASICH,KASICH,uncategorized,(APPLAUSE)
169,KASICH,KASICH,uncategorized,— to keep them in prison. I’d rather get them their medication so they could lead a decent life.
170,KASICH,KASICH,uncategorized,"Secondly, we are rehabbing the drug-addicted. Eighty percent of the people in our prisons have addictions or problems. We now treat them in the prisons, release them in the community and the recidivism rate is 10 percent and everybody across this country knows that the tsunami of drugs is — is threatening their very families."
171,KASICH,KASICH,uncategorized,"So we’re treating them and getting them on their feet. And, finally, the working poor, instead of them having come into the emergency rooms where it costs more, where they’re sicker and we end up paying, we brought a program in here to make sure that people could get on their feet."
172,KASICH,KASICH,uncategorized,And do you know what?
173,KASICH,KASICH,uncategorized,Everybody has a right to their God-given purpose.
174,KASICH,KASICH,uncategorized,"And finally, our Medicaid is growing at one of the lowest rates in the country. And, finally, we went from $8 billion in the hole to $2 billion in the black. We’ve cut $5 billion in taxes…"
175,KASICH,KASICH,uncategorized,(BUZZER NOISE)
176,KASICH,KASICH,uncategorized,"— and we’ve grown 350,000 jobs."
177,KASICH,KASICH,uncategorized,(APPLAUSE)
