index,speaker_name,speaker,topic,text
178,WALLACE,WALLACE,uncategorized,"Gentlemen, we’re turning to a new subject that all of you have been talking about and some of you have been disagreeing about, and that is the issue of immigration."
179,WALLACE,WALLACE,uncategorized,"Governor Bush, you released a new plan this week on illegal immigration focusing on enforcement, which some suggest is your effort to show that you’re not soft on that issue."
180,WALLACE,WALLACE,uncategorized,"I want to ask you about a statement that you made last year about illegal immigrants. And here’s what you said. “They broke the law, but it’s not a felony, it’s an act of love. It’s an act of commitment to your family.”"
181,WALLACE,WALLACE,uncategorized,Do you stand by that statement and do you stand by your support for earned legal status?
182,BUSH,BUSH,uncategorized,I do. I believe that the great majority of people coming here illegally have no other option. They want to provide for their family.
183,BUSH,BUSH,uncategorized,"But we need to control our border. It’s not — it’s our responsibility to pick and choose who comes in. So I — I’ve written a book about this and yet this week, I did come up with a comprehensive strategy that — that really mirrored what we said in the book, which is that we need to deal with E-Verify, we need to deal with people that come with a legal visa and overstay."
184,BUSH,BUSH,uncategorized,"We need to be much more strategic on how we deal with border enforcement, border security. We need to eliminate the sanctuary cities in this country. It is ridiculous and tragic…"
185,BUSH,BUSH,uncategorized,(APPLAUSE)
186,BUSH,BUSH,uncategorized,"— that people are dying because of the fact that — that local governments are not following the federal law. There’s much to do. And I think rather than talking about this as a wedge issue, which Barack Obama has done now for six long years, the next president — and I hope to be that president — will fix this once and for all so that we can turn this into a driver for high sustained economic growth."
187,BUSH,BUSH,uncategorized,And there should be a path to earned legal status…
188,BUSH,BUSH,uncategorized,(BUZZER NOISE)
189,BUSH,BUSH,uncategorized,"— for those that are here. Not — not amnesty, earned legal status, which means you pay a fine and do many things over an extended period of time."
190,WALLACE,WALLACE,uncategorized,"Thank you, sir."
191,WALLACE,WALLACE,uncategorized,(APPLAUSE)
192,WALLACE,WALLACE,uncategorized,"Mr. Trump, it has not escaped anybody’s notice that you say that the Mexican government, the Mexican government is sending criminals — rapists, drug dealers, across the border."
193,WALLACE,WALLACE,uncategorized,"Governor Bush has called those remarks, quote, “extraordinarily ugly.”"
194,WALLACE,WALLACE,uncategorized,"I’d like you — you’re right next to him — tell us — talk to him directly and say how you respond to that and — and you have repeatedly said that you have evidence that the Mexican government is doing this, but you have evidence you have refused or declined to share."
195,WALLACE,WALLACE,uncategorized,Why not use this first Republican presidential debate to share your proof with the American people?
196,TRUMP,TRUMP,uncategorized,"So, if it weren’t for me, you wouldn’t even be talking about illegal immigration, Chris. You wouldn’t even be talking about it."
197,TRUMP,TRUMP,uncategorized,(APPLAUSE)
198,TRUMP,TRUMP,uncategorized,"This was not a subject that was on anybody’s mind until I brought it up at my announcement. And I said, Mexico is sending. Except the reporters, because they’re a very dishonest lot, generally speaking, in the world of politics, they didn’t cover my statement the way I said it."
199,TRUMP,TRUMP,uncategorized,"The fact is, since then, many killings,murders, crime, drugs pouring across the border, are money going out and the drugs coming in. And I said we need to build a wall, and it has to be built quickly."
200,TRUMP,TRUMP,uncategorized,"And I don’t mind having a big beautiful door in that wall so that people can come into this country legally. But we need, Jeb, to build a wall, we need to keep illegals out."
201,TRUMP,TRUMP,uncategorized,(CHEERING AND APPLAUSE)
202,WALLACE,WALLACE,uncategorized,"Mr. Trump, I’ll give you 30 seconds — I’ll give you 30 seconds to answer my question, which was, what evidence do you have, specific evidence that the Mexican government is sending criminals across the border? Thirty seconds."
203,TRUMP,TRUMP,uncategorized,"Border Patrol, I was at the border last week. Border Patrol, people that I deal with, that I talk to, they say this is what’s happening. Because our leaders are stupid. Our politicians are stupid."
204,TRUMP,TRUMP,uncategorized,"And the Mexican government is much smarter, much sharper, much more cunning. And they send the bad ones over because they don’t want to pay for them. They don’t want to take care of them."
205,TRUMP,TRUMP,uncategorized,Why should they when the stupid leaders of the United States will do it for them? And that’s what is happening whether you like it or not.
206,TRUMP,TRUMP,uncategorized,(CHEERING AND APPLAUSE)
207,WALLACE,WALLACE,uncategorized,"All right. Obviously there’s a lot more to talk about this. We’re going to have more questions for the candidates on illegal immigration, plus other key topics including your questions on Facebook."
208,WALLACE,WALLACE,uncategorized,(BEGIN VIDEO CLIP)
209,UNIDENTIFIED MALE,UNIDENTIFIED MALE,uncategorized,What will be your plan on making immigration easier for those that want to do it legally?
210,UNIDENTIFIED MALE,UNIDENTIFIED MALE,uncategorized,What specific steps would you take to contain the growth of ISIS?
211,UNIDENTIFIED FEMALE,UNIDENTIFIED FEMALE,uncategorized,I’d like to know what the candidates are going to do so that I feel safe in my own country again.
212,UNIDENTIFIED FEMALE,UNIDENTIFIED FEMALE,uncategorized,(END VIDEO CLIP)
213,UNIDENTIFIED FEMALE,UNIDENTIFIED FEMALE,uncategorized,(COMMERCIAL BREAK)
214,WALLACE,WALLACE,uncategorized,Welcome back to FOX News/Facebook Republican Debate Night. We’re going to continue the questions now on illegal immigration. We kind of ended with a cliffhanger there. So let’s continue the conversation.
215,WALLACE,WALLACE,uncategorized,"Governor Kasich, I know you don’t like to talk about Donald Trump. But I do want to ask you about the merit of what he just said. When you say that the American government is stupid, that the Mexican government is sending criminals, that we’re being bamboozled, is that an adequate response to the question of illegal immigration?"
216,KASICH,KASICH,uncategorized,"Chris, first of all, I was just saying to Chris Christie, they say we’re outspoken, we need to take lessons from Donald Trump if we’re really going to learn it. Here is the thing about Donald Trump. Donald Trump is hitting a nerve in this country. He is. He’s hitting a nerve. People are frustrated. They’re fed up. They don’t think the government is working for them. And for people who want to just tune him out, they’re making a mistake."
217,KASICH,KASICH,uncategorized,"Now, he’s got his solutions. Some of us have other solutions. You know, look, I balanced the federal budget as one of the chief architects when I was in Washington. Hasn’t been done since. I was a military reformer. I took the state of Ohio from an $8 billion hole and a 350,000 job loss to a $2 billion surplus and a gain of 350,000 jobs."
218,WALLACE,WALLACE,uncategorized,"Respectfully, can we talk about illegal immigration?"
219,KASICH,KASICH,uncategorized,"But the point is that we all have solutions. Mr. Trump is touching a nerve because people want the wall to be built. They want to see an end to illegal immigration. They want to see it, and we all do. But we all have different ways of getting there. And you’re going to hear from all of us tonight about what our ideas are."
220,WALLACE,WALLACE,uncategorized,"All right, well, Senator Rubio, let me see if I can do better with you. Is it as simple as our leaders are stupid, their leaders are smart, and all of these illegals coming over are criminals?"
221,RUBIO,RUBIO,uncategorized,"Let me set the record straight on a couple of things. The first is, the evidence is now clear that the majority of people coming across the border are not from Mexico. They’re coming from Guatemala, El Salvador, Honduras. Those countries are the source of the people that are now coming in its majority."
222,RUBIO,RUBIO,uncategorized,"I also believe we need a fence. The problem is if El Chapo builds a tunnel under the fence, we have to be able to deal with that too. And that’s why you need an e-verify system and you need an entry-exit tracking system and all sorts of other things to prevent illegal immigration. But I agree with what Governor Kasich just said. People are frustrated. This is the most generous country in the world when it comes to immigration. There are a million people a year who legally immigrate to the United States, and people feel like we’re being taken advantage of. We feel like despite our generosity, we’re being taken advantage of."
223,RUBIO,RUBIO,uncategorized,"And let me tell you who never gets talked about in these debates. The people that call my office, who have been waiting for 15 years to come to the United States. And they’ve paid their fees, and they hired a lawyer, and they can’t get in. And they’re wondering, maybe they should come illegally."
224,RUBIO,RUBIO,uncategorized,(APPLAUSE)
225,RUBIO,RUBIO,uncategorized,"And so these are important issues, and we should address it. It’s a serious problem that needs to be addressed, and otherwise we’re going to keep talking about this for the next 30 years, like we have for the last 30 years."
226,WALLACE,WALLACE,uncategorized,Governor Walker.
227,WALLACE,WALLACE,uncategorized,(APPLAUSE)
228,WALLACE,WALLACE,uncategorized,"Governor Walker, from 2002 until as recently as 2013, just two years ago, you supported comprehensive immigration reform, including a path to citizenship. Now you say that was a quick reaction to something you hadn’t really thought about, and that you’ve changed your mind. Other than politics, could you explain why in the last two years you’ve changed your position on a path to citizenship, and are there other past positions that we shouldn’t hold you to?"
229,WALKER,WALKER,uncategorized,"Chris, I actually said that on your show earlier this year."
230,WALKER,WALKER,uncategorized,(CROSSTALK)
231,WALKER,WALKER,uncategorized,I acknowledged that. I said I actually listened to the American people. And I think people across America want a leader who’s actually going to listen to them.
232,WALKER,WALKER,uncategorized,"I talked to border state governors and other elected officials. I look at how this president, particularly through last November, messed up the immigration system in this country. Most importantly, I listened to the people of America."
233,WALKER,WALKER,uncategorized,"I believe we need to secure the border. I’ve been to the border with Governor Abbott in Texas and others, seeing the problems that they have there. There is international criminal organizations penetrating our southern based borders, and we need to do something about it. Secure the border, enforce the law, no amnesty, and go forward with the legal immigration system that gives priority to American working families and wages."
234,(APPLAUSE) WALLACE,(APPLAUSE) WALLACE,uncategorized,"Senator Cruz, some 1,400 people submitted questions on this very hot topic of illegal immigration on Facebook, and a number of them were about the murder of Kate Steinle in San Francisco, allegedly shot down by an illegal. Doug Bettencourt sent this question, “will you support Kate Steinle’s Law,” which would impose a mandatory five-year prison term for an illegal who is deported and then returns to this country? “And will you defund sanctuary cities for violating federal law?”"
235,CRUZ,CRUZ,uncategorized,"Chris, absolutely yes. And not only will I support it–"
236,CRUZ,CRUZ,uncategorized,(APPLAUSE)
237,CRUZ,CRUZ,uncategorized,"— I have authored Kate’s law in the United States Senate and filed that legislation. I tried to get the Senate to vote to pass Kate’s law on the floor of the Senate just one week ago, and the leader of our own party blocked a vote on Kate’s law."
238,CRUZ,CRUZ,uncategorized,"You know, there was reference made to our leaders being stupid. It’s not a question of stupidity. It’s that they don’t want to enforce the immigration laws. That there are far too many in the Washington cartel that support amnesty."
239,CRUZ,CRUZ,uncategorized,"President Obama has talked about fundamentally transforming this country. There’s 7 billion people across the face of the globe, many of whom want to come to this country. If they come legally, great. But if they come illegally and they get amnesty, that is how we fundamentally change this country, and it really is striking."
240,CRUZ,CRUZ,uncategorized,"A majority of the candidates on this stage have supported amnesty. I have never supported amnesty, and I led the fight against Chuck Schumer’s gang of eight amnesty legislation in the Senate."
241,KELLY,KELLY,uncategorized,"Alright, gentlemen, we’re gonna switch topics now and talk a bit about terror and national security."
242,KELLY,KELLY,uncategorized,"Governor Christie. You’ve said that Senator Paul’s opposition to the NSA’s collection of phone records has made the United States weaker and more vulnerable, even going so far as to say that he should be called before Congress to answer for it if we should be hit by another terrorist attack."
243,KELLY,KELLY,uncategorized,Do you really believe you can assign blame to Senator Paul just for opposing he bulk collection of people’s phone records in the event of a terrorist attack?
244,CHRISTIE,CHRISTIE,uncategorized,"Yes, I do. And I’ll tell you why because I’m the only person on this stage who’s actually filed applications under the Patriot Act, who has gone before the federal — the Foreign Intelligence Service court, who has prosecuted and investigated and jailed terrorists in this country after September 11th."
245,CHRISTIE,CHRISTIE,uncategorized,"I was appointed U.S. attorney by President Bush on September 10th, 2001, and the world changed enormously the next day, and that happened in my state."
246,CHRISTIE,CHRISTIE,uncategorized,"This is not theoretical to me. I went to the funerals. We lost friends of ours in the Trade Center that day. My own wife was two blocks from the Trade Center that day, at her office, having gone through it that morning."
247,CHRISTIE,CHRISTIE,uncategorized,"When you actually have to be responsible for doing this, you can do it, and we did it, for seven years in my office, respecting civil liberties and protecting the homeland."
248,CHRISTIE,CHRISTIE,uncategorized,"And I will make no apologies, ever, for protecting the lives and the safety of the American people. We have to give more tools to our folks to be able to do that, not fewer, and then trust those people and oversee them to do it the right way. As president, that is exactly what I’ll do."
249,PAUL,PAUL,uncategorized,"Megyn, may I respond?"
250,PAUL,PAUL,uncategorized,(APPLAUSE)
251,PAUL,PAUL,uncategorized,May I respond?
252,KELLY,KELLY,uncategorized,"Go ahead, sir."
253,PAUL,PAUL,uncategorized,"I want to collect more records from terrorists, but less records from innocent Americans. The Fourth Amendment was what we fought the Revolution over! John Adams said it was the spark that led to our war for independence, and I’m proud of standing for the Bill of Rights, and I will continue to stand for the Bill of Rights."
254,PAUL,PAUL,uncategorized,(APPLAUSE)
255,CHRISTIE,CHRISTIE,uncategorized,"And — and, Megyn? Megyn, that’s a — that, you know, that’s a completely ridiculous answer. “I want to collect more records from terrorists, but less records from other people.” How are you supposed to know, Megyn?"
256,PAUL,PAUL,uncategorized,Use the Fourth Amendment!
257,CHRISTIE,CHRISTIE,uncategorized,What are you supposed to…
258,PAUL,PAUL,uncategorized,Use the Fourth Amendment!
259,CHRISTIE,CHRISTIE,uncategorized,"…how are you supposed to — no, I’ll tell you how you, look…"
260,PAUL,PAUL,uncategorized,Get a warrant!
261,CHRISTIE,CHRISTIE,uncategorized,"Let me tell you something, you go…"
262,PAUL,PAUL,uncategorized,Get a judge to sign the warrant!
263,CHRISTIE,CHRISTIE,uncategorized,"When you — you know, senator…"
264,CHRISTIE,CHRISTIE,uncategorized,(CROSSTALK)
265,KELLY,KELLY,uncategorized,"Governor Christie, make your point."
266,CHRISTIE,CHRISTIE,uncategorized,"Listen, senator, you know, when you’re sitting in a subcommittee, just blowing hot air about this, you can say things like that."
267,CHRISTIE,CHRISTIE,uncategorized,(APPLAUSE)
268,CHRISTIE,CHRISTIE,uncategorized,"When you’re responsible for protecting the lives of the American people, then what you need to do is to make sure…"
269,PAUL,PAUL,uncategorized,"See, here’s the problem."
270,CHRISTIE,CHRISTIE,uncategorized,…is to make sure that you use the system (ph) the way it’s supposed to work.
271,PAUL,PAUL,uncategorized,"Here’s the problem, governor. Here’s the problem, governor. You fundamentally misunderstand the Bill of Rights."
272,PAUL,PAUL,uncategorized,"Every time you did a case, you got a warrant from a judge. I’m talking about searches without warrants…"
273,CHRISTIE,CHRISTIE,uncategorized,There is no…
274,PAUL,PAUL,uncategorized,"…indiscriminately, of all Americans’ records, and that’s what I fought to end."
275,PAUL,PAUL,uncategorized,"I don’t trust President Obama with our records. I know you gave him a big hug, and if you want to give him a big hug again, go right ahead."
276,PAUL,PAUL,uncategorized,(APPLAUSE)
277,KELLY,KELLY,uncategorized,"Go ahead, governor."
278,CHRISTIE,CHRISTIE,uncategorized,"And you know — you know, Senator Paul? Senator Paul, you know, the hugs that I remember are the hugs that I gave to the families who lost their people on September 11th."
279,CHRISTIE,CHRISTIE,uncategorized,"Those are the hugs I remember, and those had nothing to do — and those had nothing to do with politics, unlike what you’re doing by cutting speeches on the floor of the Senate, then putting them on the Internet within half an hour to raise money for your campaign…"
280,KELLY,KELLY,uncategorized,Alright.
281,CHRISTIE,CHRISTIE,uncategorized,…and while still putting our country at risk.
282,CHRISTIE,CHRISTIE,uncategorized,(CROSSTALK)
283,KELLY,KELLY,uncategorized,"Alright, we’ve gotta cut it off there."
284,KELLY,KELLY,uncategorized,"We have plenty more we want to get to. That was an interesting exchange, thank you for that."
285,CHRISTIE,CHRISTIE,uncategorized,"You know what, Megyn, can I…"
286,KELLY,KELLY,uncategorized,"Well, I want to move on, because I have — we’re gonna get to you, governor, but I — I really wanna get to a Facebook questioner. His name is Alex Chalgren, and he has the following question"
287,KELLY,KELLY,uncategorized,(BEGIN VIDEO CLIP)
288,QUESTION,QUESTION,uncategorized,"My question is, how would the candidates stop the treacherous actions of ISIS — ISIL and its growing influence in the U.S., if they were to become president?"
289,(END VIDEO CLIP) KELLY,(END VIDEO CLIP) KELLY,uncategorized,"Senator Cruz, I wanna talk to you about this, because many of the Facebook users and — and — the — the folks on Facebook wanted the candidates to speak to ISIS tonight."
290,(END VIDEO CLIP) KELLY,(END VIDEO CLIP) KELLY,uncategorized,You asked the chairman of the joint chiefs a question: “What would it take to destroy ISIS in 90 days?” He told you “IISIS will only be truly destroyed once they are rejected by the populations in which they hide.” And then you accused him of pushing Medicaid for the Iraqis.
291,(END VIDEO CLIP) KELLY,(END VIDEO CLIP) KELLY,uncategorized,How would you destroy ISIS in 90 days?
292,CRUZ,CRUZ,uncategorized,"Megyn, we need a commander in chief that speaks the truth. We will not defeat radical Islamic terrorism so long as we have a president unwilling to utter the words, “radical Islamic terrorism”."
293,CRUZ,CRUZ,uncategorized,(APPLAUSE)
294,CRUZ,CRUZ,uncategorized,"When I asked General Dempsey, the chairman of the joint chiefs, what would be required militarily to destroy ISIS, he said there is no military solution. We need to change the conditions on the ground so that young men are not in poverty and susceptible to radicalization. That, with all due respect, is nonsense."
295,CRUZ,CRUZ,uncategorized,"It’s the same answer the State Department gave that we need to give them jobs. What we need is a commander in chief that makes — clear, if you join ISIS, if you wage jihad on America, then you are signing your death warrant."
296,KELLY,KELLY,uncategorized,You don’t see it as…
297,KELLY,KELLY,uncategorized,(APPLAUSE)
298,KELLY,KELLY,uncategorized,…an ideological problem — an ideological problem in addition to a military one?
299,KELLY,KELLY,uncategorized,(APPLAUSE)
300,CRUZ,CRUZ,uncategorized,"Megyn, of course it’s an ideological problem, that’s one of the reasons I introduce the Expatriate Terrorist Act in the Senate that said if any American travels to the Middle East and joining ISIS, that he or she forfeits their citizenship so they don’t use a passport to come back and wage jihad on Americans."
301,CRUZ,CRUZ,uncategorized,(APPLAUSE)
302,CRUZ,CRUZ,uncategorized,"Yes, it is ideological, and let me contrast President Obama, who at the prayer breakfast, essentially acted as an apologist. He said, “Well, gosh, the crusades, the inquisitions–”"
303,CRUZ,CRUZ,uncategorized,"We need a president that shows the courage that Egypt’s President al-Sisi, a Muslim, when he called out the radical Islamic terrorists who are threatening the world."
304,CRUZ,CRUZ,uncategorized,(APPLAUSE)
305,KELLY,KELLY,uncategorized,"Governor Bush, for days on end in this campaign, you struggled to answer a question about whether knowing what we know now…"
306,BUSH,BUSH,uncategorized,…I remember…
307,KELLY,KELLY,uncategorized,…we would’ve invaded Iraq…
308,BUSH,BUSH,uncategorized,"…I remember, Megyn."
309,BUSH,BUSH,uncategorized,(LAUGHTER)
310,KELLY,KELLY,uncategorized,"I remember it too, and ISIS, of course, is now thriving there."
311,KELLY,KELLY,uncategorized,"You finally said, “No.”"
312,KELLY,KELLY,uncategorized,"To the families of those who died in that war who say they liberated and deposed a ruthless dictator, how do you look at them now and say that your brothers war was a mistake?"
313,BUSH,BUSH,uncategorized,"Knowing what we know now, with faulty intelligence, and not having security be the first priority when — when we invaded, it was a mistake. I wouldn’t have gone in, however, for the people that did lose their lives, and the families that suffer because of it — I know this full well because as governor of the state of Florida, I called every one of them. Every one of them that I could find to tell them that I was praying for them, that I cared about them, and it was really hard to do."
314,BUSH,BUSH,uncategorized,"And, every one of them said that their child did not die in vain, or their wife, of their husband did not die in vain."
315,BUSH,BUSH,uncategorized,"So, why it was difficult for me to do it was based on that. Here’s the lesson that we should take from this, which relates to this whole subject, Barack Obama became president, and he abandoned Iraq. He left, and when he left Al Qaida was done for. ISIS was created because of the void that we left, and that void now exists as a caliphate the size of Indiana."
316,BUSH,BUSH,uncategorized,"To honor the people that died, we need to — we need to — stop the — Iran agreement, for sure, because the Iranian mullahs have their blood on their hands, and we need to take out ISIS with every tool at our disposal."
317,BUSH,BUSH,uncategorized,(APPLAUSE)
318,KELLY,KELLY,uncategorized,"Governor Walker, in February you said that we needed to gain partners in the Arab world. Which Arab country not already in the U.S. led coalition has potential to be our greatest partner?"
319,WALKER,WALKER,uncategorized,"What about then (ph), we need to focus on the ones we have. You look at Egypt, probably the best relationship we’ve had in Israel, at least in my lifetime, incredibly important."
320,WALKER,WALKER,uncategorized,"You look at the Saudis — in fact, earlier this year, I met with Saudi leaders, and leaders from the United Arab Emirates, and I asked them what’s the greatest challenge in the world today? Set aside the Iran deal. They said it’s the disengagement of America. We are leading from behind under the Obama-Clinton doctrine — America’s a great country. We need to stand up and start leading again, and we need to have allies, not just in Israel, but throughout the Persian Gulf."
321,KELLY,KELLY,uncategorized,"Dr. Carson, in one of his first acts as commander in chief, President Obama signed an executive order banning enhanced interrogation techniques in fighting terror. As president, would you bring back water boarding?"
322,CARSON,CARSON,uncategorized,"Well, thank you, Megyn, I wasn’t sure I was going to get to talk again."
323,CARSON,CARSON,uncategorized,(APPLAUSE)
324,KELLY,KELLY,uncategorized,"We have a lot for you, don’t worry."
325,KELLY,KELLY,uncategorized,(LAUGHTER)
326,KELLY,KELLY,uncategorized,(APPLAUSE)
327,KELLY,KELLY,uncategorized,"Fear not, you may rue that request."
