index,speaker_name,speaker,topic,text
328,CARSON,CARSON,uncategorized,"Alright. You know, what we do in order to get the information that we need is our business, and I wouldn’t necessarily be broadcasting what we’re going to do."
329,CARSON,CARSON,uncategorized,(APPLAUSE)
330,CARSON,CARSON,uncategorized,We’ve gotten into this — this mindset of fighting politically correct wars. There is no such thing as a politically correct war.
331,CARSON,CARSON,uncategorized,(APPLAUSE)
332,CARSON,CARSON,uncategorized,"The left, of course, will say Carson doesn’t believe in the Geneva Convention, Carson doesn’t believe in fighting stupid wars. And — and what we have to remember is we want to utilize the tremendous intellect that we have in the military to win wars."
333,CARSON,CARSON,uncategorized,"And I’ve talked to a lot of the generals, a lot of our advanced people. And believe me, if we gave them the mission, which is what the commander-in-chief does, they would be able to carry it out."
334,CARSON,CARSON,uncategorized,"And if we don’t tie their hands behind their back, they will do it…"
335,CARSON,CARSON,uncategorized,(BUZZER NOISE)
336,CARSON,CARSON,uncategorized,— extremely effectively.
337,CARSON,CARSON,uncategorized,(APPLAUSE)
338,BAIER,BAIER,uncategorized,"Gentlemen, the next series of questions deals with ObamaCare and the role of the federal government."
339,BAIER,BAIER,uncategorized,"Mr. Trump, ObamaCare is one of the things you call a disaster."
340,TRUMP,TRUMP,uncategorized,"A complete disaster, yes."
341,BAIER,BAIER,uncategorized,Saying it needs to be repealed and replaced.
342,TRUMP,TRUMP,uncategorized,Correct.
343,BAIER,BAIER,uncategorized,"Now, 15 years ago, uncalled yourself a liberal on health care. You were for a single-payer system, a Canadian-style system."
344,BAIER,BAIER,uncategorized,Why were you for that then and why aren’t you for it now?
345,TRUMP,TRUMP,uncategorized,"First of all, I’d like to just go back to one. In July of 2004, I came out strongly against the war with Iraq, because it was going to destabilize the Middle East. And I’m the only one on this stage that knew that and had the vision to say it. And that’s exactly what happened."
346,BAIER,BAIER,uncategorized,But on ObamaCare…
347,TRUMP,TRUMP,uncategorized,And the Middle East became totally destabilized. So I just want to say.
348,TRUMP,TRUMP,uncategorized,"As far as single payer, it works in Canada. It works incredibly well in Scotland. It could have worked in a different age, which is the age you’re talking about here."
349,TRUMP,TRUMP,uncategorized,"What I’d like to see is a private system without the artificial lines around every state. I have a big company with thousands and thousands of employees. And if I’m negotiating in New York or in New Jersey or in California, I have like one bidder. Nobody can bid."
350,TRUMP,TRUMP,uncategorized,You know why?
351,TRUMP,TRUMP,uncategorized,"Because the insurance companies are making a fortune because they have control of the politicians, of course, with the exception of the politicians on this stage."
352,TRUMP,TRUMP,uncategorized,But they have total control of the politicians. They’re making a fortune.
353,TRUMP,TRUMP,uncategorized,Get rid of the artificial lines and you will have…
354,TRUMP,TRUMP,uncategorized,(BUZZER NOISE)
355,TRUMP,TRUMP,uncategorized,— yourself great plans. And then we have to take care of the people that can’t take care of themselves. And I will do that through a different system.
356,TRUMP,TRUMP,uncategorized,(CROSSTALK)
357,BAIER,BAIER,uncategorized,"Mr. Trump, hold up one second."
358,PAUL,PAUL,uncategorized,I’ve got a news flash…
359,BAIER,BAIER,uncategorized,"All right, now, hold on, Senator Paul…"
360,PAUL,PAUL,uncategorized,"News flash, the Republican Party’s been fighting against a single-payer system…"
361,BAIER,BAIER,uncategorized,OK.
362,PAUL,PAUL,uncategorized,— for a decade. So I think you’re on the wrong side of this if you’re still arguing for a single-payer system.
363,TRUMP,TRUMP,uncategorized,I’m not — I’m not are — I don’t think you heard me. You’re having a hard time tonight.
364,BAIER,BAIER,uncategorized,"All right, let me…"
365,BAIER,BAIER,uncategorized,(APPLAUSE)
366,BAIER,BAIER,uncategorized,"Mr. Trump, it’s not just your past support for single- payer health care. You’ve also supported a host of other liberal policies. Use — you’ve also donated to several Democratic candidates, Hillary Clinton included, Nancy Pelosi."
367,BAIER,BAIER,uncategorized,You explained away those donations saying you did that to get business-related favors.
368,BAIER,BAIER,uncategorized,"And you said recently, quote, “When you give, they do whatever the hell you want them to do.”"
369,TRUMP,TRUMP,uncategorized,You’d better believe it.
370,BAIER,BAIER,uncategorized,So what specifically did…
371,UNIDENTIFIED MALE,UNIDENTIFIED MALE,uncategorized,That’s true.
372,BAIER,BAIER,uncategorized,— they do?
373,TRUMP,TRUMP,uncategorized,"If I ask them, if I need them, you know, most of the people on this stage I’ve given to, just so you understand, a lot of money."
374,UNIDENTIFIED MALE,UNIDENTIFIED MALE,uncategorized,Not me.
375,UNIDENTIFIED MALE,UNIDENTIFIED MALE,uncategorized,Not me.
376,UNIDENTIFIED MALE,UNIDENTIFIED MALE,uncategorized,(LAUGHTER)
377,UNIDENTIFIED MALE,UNIDENTIFIED MALE,uncategorized,But you’re welcome to give me (INAUDIBLE) Donald if you’d like.
378,TRUMP,TRUMP,uncategorized,Many of them.
379,UNIDENTIFIED MALE,UNIDENTIFIED MALE,uncategorized,"Actually, to be clear…"
380,UNIDENTIFIED MALE,UNIDENTIFIED MALE,uncategorized,(CROSSTALK)
381,UNIDENTIFIED MALE,UNIDENTIFIED MALE,uncategorized,— he supported Charlie Crist.
382,TRUMP,TRUMP,uncategorized,Not much.
383,UNIDENTIFIED MALE,UNIDENTIFIED MALE,uncategorized,"Hey, Charlie…"
384,UNIDENTIFIED MALE,UNIDENTIFIED MALE,uncategorized,(CROSSTALK)
385,TRUMP,TRUMP,uncategorized,But I…
386,TRUMP,TRUMP,uncategorized,(CROSSTALK)
387,TRUMP,TRUMP,uncategorized,"— Donald, if you…"
388,(CROSSTALK) TRUMP,(CROSSTALK) TRUMP,uncategorized,I have good…
389,UNIDENTIFIED MALE,UNIDENTIFIED MALE,uncategorized,"— this campaign, I hope you will give to me."
390,TRUMP,TRUMP,uncategorized,Good.
391,UNIDENTIFIED MALE,UNIDENTIFIED MALE,uncategorized,OK.
392,TRUMP,TRUMP,uncategorized,"Sounds good. Sounds good to me, Governor."
393,TRUMP,TRUMP,uncategorized,"I will tell you that our system is broken. I gave to many people, before this, before two months ago, I was a businessman. I give to everybody. When they call, I give."
394,TRUMP,TRUMP,uncategorized,And do you know what?
395,TRUMP,TRUMP,uncategorized,"When I need something from them two years later, three years later, I call them, they are there for me."
396,UNIDENTIFIED MALE,UNIDENTIFIED MALE,uncategorized,So what did you get?
397,TRUMP,TRUMP,uncategorized,And that’s a broken system.
398,UNIDENTIFIED MALE,UNIDENTIFIED MALE,uncategorized,What did you get from Hillary Clinton and Nancy Pelosi?
399,TRUMP,TRUMP,uncategorized,"Well, I’ll tell you what, with Hillary Clinton, I said be at my wedding and she came to my wedding."
400,TRUMP,TRUMP,uncategorized,You know why?
401,TRUMP,TRUMP,uncategorized,"She didn’t have a choice because I gave. I gave to a foundation that, frankly, that foundation is supposed to do good. I didn’t know her money would be used on private jets going all over the world. It was."
402,TRUMP,TRUMP,uncategorized,But…
403,TRUMP,TRUMP,uncategorized,(BUZZER NOISE)
404,TRUMP,TRUMP,uncategorized,(CROSSTALK)
405,BAIER,BAIER,uncategorized,Hold on.
406,BAIER,BAIER,uncategorized,We’re going to — we’re going to move on.
407,BAIER,BAIER,uncategorized,(CROSSTALK)
408,BAIER,BAIER,uncategorized,"We’ll come back to you, Governor Walker."
409,WALKER,WALKER,uncategorized,"Just one second on this, though."
410,WALKER,WALKER,uncategorized,We — we spent a lot of time talking about Hillary Clinton and —and pitting us back and forth.
411,WALKER,WALKER,uncategorized,"Let’s be clear, we should be talking about Hillary Clinton on that last subject, because everywhere in the world that Hillary Clinton touched is more messed up today than before she and the president (INAUDIBLE)."
412,BAIER,BAIER,uncategorized,We have many questions to come.
413,WALKER,WALKER,uncategorized,It’s true.
414,BAIER,BAIER,uncategorized,Many questions to come.
415,BAIER,BAIER,uncategorized,(APPLAUSE)
416,BAIER,BAIER,uncategorized,"Governor Huckabee, on Facebook, John Pietricone asked this, “Will you abolish or take away the powers and cut the size of the EPA, the IRS, the Department of Education?”"
417,BAIER,BAIER,uncategorized,"Now, broadly…"
418,BAIER,BAIER,uncategorized,(APPLAUSE)
419,BAIER,BAIER,uncategorized,"— broadly, the size of government is a big concern for Facebook users, Facebook persons, as well as, obviously, conservatives."
420,BAIER,BAIER,uncategorized,"But year after year, decade after decade, there are promises from Republicans to shrink government. But year after year, decade after decade, it doesn’t happen."
421,BAIER,BAIER,uncategorized,"In fact, it gets bigger, even under Republican politicians."
422,BAIER,BAIER,uncategorized,"So the question is, at this point, is the government simply too big for any one person, even a Republican, to shrink?"
423,HUCKABEE,HUCKABEE,uncategorized,It’s not too big to shrink. But the problem is we have a Wall Street-to-Washington access of power that has controlled the political climate. The donor class feeds the political class who does the dance that the donor class wants. And the result is federal government keeps getting bigger.
424,HUCKABEE,HUCKABEE,uncategorized,"Every person on this stage who has been a governor will tell that you the biggest fight they had was not the other party. Wasn’t even the legislature. It was the federal government, who continually put mandates on the states that we had to suck up and pay for."
425,HUCKABEE,HUCKABEE,uncategorized,"And the fact is there are a lot of things happening at the federal level that are absolutely beyond the jurisdiction of the Constitution. This is power that should be shifted back to the states, whether it’s the EPA, there is no role at the federal level for the Department of Education."
426,HUCKABEE,HUCKABEE,uncategorized,(CHEERING AND APPLAUSE)
427,HUCKABEE,HUCKABEE,uncategorized,"And I’m still one who says that we can get rid of the Internal Revenue Service if we would pass the fair tax, which is a tax on consumption rather than a tax on people’s income, and move power back where the founders believed it should have been all along."
428,BAIER,BAIER,uncategorized,Dr. Carson…
429,UNIDENTIFIED MALE,UNIDENTIFIED MALE,uncategorized,"Bret, Bret, Bret…"
430,BAIER,BAIER,uncategorized,"Dr. Carson, do you agree with that?"
431,CARSON,CARSON,uncategorized,"What I agree with is that we need a significantly changed taxation system. And the one that I’ve advocated is based on tithing, because I think God is a pretty fair guy."
432,CARSON,CARSON,uncategorized,"And he said, you know, if you give me a tithe, it doesn’t matter how much you make. If you’ve had a bumper crop, you don’t owe me triple tithes. And if you’ve had no crops at all, you don’t owe me no tithes. So there must be something inherently fair about that."
433,CARSON,CARSON,uncategorized,"And that’s why I’ve advocated a proportional tax system. You make $10 billion, you pay a billion. You make $10, you pay one. And everybody gets treated the same way. And you get rid of the deductions, you get rid of all the loopholes, and…"
434,CARSON,CARSON,uncategorized,(DOUBLE BELL RINGS)
435,BAIER,BAIER,uncategorized,Governor Bush?
436,CARSON,CARSON,uncategorized,And I have a lot more to say about it.
437,BAIER,BAIER,uncategorized,"We’re going to come back to you, Dr. Carson."
438,BAIER,BAIER,uncategorized,"Governor Bush, you are one of the few people on the stage who advocates for Common Core education standards, reading and math. A lot of people on this stage vigorously oppose federal involvement in education. They say it should all be handled locally."
439,BAIER,BAIER,uncategorized,"President Obama’s secretary of education, Arnie Duncan, has said that most of the criticism of Common Core is due to a, quote, “fringe group of critics.” Do you think that’s accurate?"
440,BUSH,BUSH,uncategorized,"No, I don’t. And I don’t believe the federal government should be involved in the creation of standards directly or indirectly, the creation of curriculum or content. It is clearly a state responsibility."
441,BUSH,BUSH,uncategorized,I’m for higher standards…
442,BUSH,BUSH,uncategorized,(APPLAUSE)
443,BUSH,BUSH,uncategorized,"… measured in an intellectually honest way, with abundant school choice, ending social promotion. And I know how to do this because as governor of the state of Florida I created the first statewide voucher program in the country, the second statewide voucher program, in the country and the third statewide voucher program in the country."
444,BUSH,BUSH,uncategorized,"And we had rising student achievement across the board, because high standards, robust accountability, ending social promotion in third grade, real school choice across the board, challenging the teachers union and beating them is the way to go."
445,BUSH,BUSH,uncategorized,And Florida’s low income kids had the greatest gains inside the country. Our graduation rate improved by 50 percent. That’s what I’m for.
446,BAIER,BAIER,uncategorized,"Senator Rubio, why is Governor Bush wrong on Common Core?"
447,RUBIO,RUBIO,uncategorized,"Well, first off, I too believe in curriculum reform. It is critically important in the 21st Century. We do need curriculum reform. And it should happen at the state and local level. That is where educational policy belongs, because if a parent is unhappy with what their child is being taught in school, they can go to that local school board or their state legislature, or their governor and get it changed."
448,RUBIO,RUBIO,uncategorized,"Here’s the problem with Common Core. The Department of Education, like every federal agency, will never be satisfied. They will not stop with it being a suggestion. They will turn it into a mandate."
449,RUBIO,RUBIO,uncategorized,"In fact, what they will begin to say to local communities is, you will not get federal money unless do you things the way we want you to do it. And they will use Common Core or any other requirements that exists nationally to force it down the throats of our people in our states."
450,RUBIO,RUBIO,uncategorized,(APPLAUSE)
451,BAIER,BAIER,uncategorized,And do you agree with your old friend?
452,BUSH,BUSH,uncategorized,"He is definitely my friend. And I think the states ought to create these standards. And if states want to opt out of Common Core, fine. Just make sure your standards are high."
453,BUSH,BUSH,uncategorized,"Because today in America, a third of our kids, after we spend more per student than any country in the world other than a couple rounding errors, to be honest with you, 30 percent are college- and/or career-ready."
454,BUSH,BUSH,uncategorized,"If we are going to compete in this world we’re in today, there is no possible way we can do it with lowering expectations and dumbing down everything. Children are going to suffer and families’ hearts are going to be broken that their kids won’t be able to get a job in the 21st Century."
455,BUSH,BUSH,uncategorized,(APPLAUSE)
456,BAIER,BAIER,uncategorized,"We have many more questions coming on a host of topics, here from Quicken Loans Arena in Cleveland. Stay with us."
457,BAIER,BAIER,uncategorized,(BEGIN VIDEO CLIP)
458,UNIDENTIFIED MALE,UNIDENTIFIED MALE,uncategorized,What would make stand out as the best choice for the Republican nomination?
459,UNIDENTIFIED MALE,UNIDENTIFIED MALE,uncategorized,How do you intend to go about student loan reform?
460,UNIDENTIFIED FEMALE,UNIDENTIFIED FEMALE,uncategorized,What will be the first thing you will do to stimulate economic growth in our country and bring more jobs to the United States?
461,UNIDENTIFIED FEMALE,UNIDENTIFIED FEMALE,uncategorized,(END VIDEO CLIP)
462,UNIDENTIFIED FEMALE,UNIDENTIFIED FEMALE,uncategorized,(COMMERCIAL BREAK)
463,BAIER,BAIER,uncategorized,We have many more questions coming on a host of topics. Here from Quicken Loans Arena in Cleveland. Stay with us.
464,BAIER,BAIER,uncategorized,(BEGIN VIDEO CLIP)
465,UNIDENTIFIED MALE,UNIDENTIFIED MALE,uncategorized,What would make you stand out as the best choice for the Republican nomination?
466,UNIDENTIFIED MALE,UNIDENTIFIED MALE,uncategorized,How do you intend to go about student loan reform?
467,UNIDENTIFIED FEMALE,UNIDENTIFIED FEMALE,uncategorized,What will be the first thing you will do to stimulate economic growth in our country and bring more jobs to the United States?
468,UNIDENTIFIED FEMALE,UNIDENTIFIED FEMALE,uncategorized,(END VIDEO CLIP)
469,(COMMERCIAL BREAK) KELLY,(COMMERCIAL BREAK) KELLY,uncategorized,"It’s just before 1000 p.m. on the East Coast. Welcome back to Quicken Loans Arena in Cleveland, Ohio, and the very first Republican primary debate of the 2016 presidential campaign. Ten candidates on the stage, selected based on their standing in five national polls. And tonight they are facing off, answering the questions you want asked. We hope."
470,(COMMERCIAL BREAK) KELLY,(COMMERCIAL BREAK) KELLY,uncategorized,(LAUGHTER)
471,WALLACE,WALLACE,uncategorized,"Gentlemen, we’re obviously digging into some subjects in depth, but we’re also going to change it up every once in a while throughout the next hour and have many rounds where we ask, you are not going to like it, only a couple of candidates questions on those subjects. This is the first of the many rounds, and it’s about somebody whose name probably hasn’t been mentioned enough so far tonight."
472,WALLACE,WALLACE,uncategorized,"Governor Kasich, let me start with you. Whoever the Republican nominee —"
473,WALLACE,WALLACE,uncategorized,(APPLAUSE)
474,WALLACE,WALLACE,uncategorized,"Whoever the Republican nominee is, it looks at least for now like whoever that nominee is, he or she, will be facing off against Hillary Clinton. You know how she will come after whoever the Republican nominee is. She will say that you, whoever it is, support the rich while she supports the middle class. That you want to suppress the rights of women and minorities. She wants to move the country forward while you, the Republicans, want to take the country back to the past."
475,WALLACE,WALLACE,uncategorized,"How will you, if you’re the nominee, how will you answer that and take Hillary Clinton on?"
476,KASICH,KASICH,uncategorized,"Let’s start off with my father being a mailman. So I understand the concerns of all the folks across this country, some of whom having trouble, you know, making ends meet. But I think she will come in a narrow way. The nominee of this party, if they’re going to win, has got to come at it in a big way, which is pro-growth. Which is balancing budgets. You know, we were talking about it. People were saying, could we do it? I was the chairman of the Budget Committee and the lead architect the last time it happened in Washington, and when we did it we had great economic growth, we cut taxes, and we had a big surplus."
477,KASICH,KASICH,uncategorized,"Economic growth is the key. Economic growth is the key to everything. But once you have economic growth, it is important that we reach out to people who live in the shadows, the people who don’t seem to ever think that they get a fair deal. And that includes people in our minority community; that includes people who feel as though they don’t have a chance to move up."
478,KASICH,KASICH,uncategorized,"You know, America is a miracle country. And we have to restore the sense that the Amiracle (ph) will apply to you. Each and every one of the people in this country who’s watching tonight, lift everybody, unite everybody and build a stronger United States of America again. It will be and can be done."
479,WALLACE,WALLACE,uncategorized,"I know that all of you would like to answer this question, but we’re only going to ask one other candidate before we move on to a different subject, Dr. Carson."
480,WALLACE,WALLACE,uncategorized,"Basically, same question to you. If Hillary Clinton is the nominee and she comes at you with that kind of line of attack, how will you take Iraq?"
481,CARSON,CARSON,uncategorized,"If Hillary is the candidate, which I doubt, that would be a dream come true."
482,CARSON,CARSON,uncategorized,(LAUGHTER)
483,CARSON,CARSON,uncategorized,"But you know, the fact of the matter is, she is the epitome of the progressive — the secular progressive movement. And she counts on the fact that people are uninformed, the Alinsky Model, taking advantage of useful idiots."
484,CARSON,CARSON,uncategorized,"Well, I just happen to believe that people are not stupid."
485,CARSON,CARSON,uncategorized,"(APPLAUSE) And the way I will come at it is to educate people, help people to actually understand that it is that progressive movement that is causing them the problems."
486,CARSON,CARSON,uncategorized,"You know, you look at the — the national debt and how it’s being driven up. If I was trying to destroy this country, what I would do is find a way to drive wedges between all the people, drive the debt to an unsustainable level, and then step off the stage as a world leader and let our enemies increase while we decreased our capacity as a military person. And that’s what she’s doing."
487,CARSON,CARSON,uncategorized,(APPLAUSE)
488,WALLACE,WALLACE,uncategorized,"Gentlemen, we’re going to turn now to the subject of the economy, jobs and money and the government. And Governor Bush, I’m going to start with you."
489,WALLACE,WALLACE,uncategorized,You have made a bold promise in your announcement. You have promised four percent economic growth and 19 million new jobs if you are fortunate enough to serve two terms as president.
490,WALLACE,WALLACE,uncategorized,"That many jobs, 19 million, would be triple what your father and your brother accomplished together. And four percent growth, the last president to average that was Lyndon Johnson during the height of the Vietnam War. So question, how on Earth specifically would you pull that off?"
491,BUSH,BUSH,uncategorized,"We’ve done it 27 times since World War II. I think we need to lift our spirits and have high, lofty expectations for this great country of ours."
492,BUSH,BUSH,uncategorized,"The new normal of two percent that the left is saying you can’t do anything about is so dangerous for our country. There’s 6 million people living in poverty today, more than when Barack Obama got elected. 6.5 million people are working part-time, most of whom want to work full-time. We’ve created rules and taxes on top of every aspiration of people, and the net result is we’re not growing fast, income is not growing. A four percent growth strategy means you fix a convoluted tax code. You get in and you change every aspect of regulations that are job killers. You get rid of Obamacare and replace it with something that doesn’t suppress wages and kill jobs."
493,BUSH,BUSH,uncategorized,(APPLAUSE)
494,BUSH,BUSH,uncategorized,"You embrace the energy revolution in our country. This president and Hillary Clinton, who can’t even say she’s for the X.L. pipeline even after she’s left? Give me a break. Of course we’re for it. We should be for these things to create high sustained economic growth. And frankly, fixing our immigration system and turning it into an economic driver is part of this as well. We can do this."
495,BUSH,BUSH,uncategorized,(APPLAUSE)
496,WALLACE,WALLACE,uncategorized,Governor Walker.
497,WALLACE,WALLACE,uncategorized,"(APPLAUSE) Governor Walker, when you ran for governor of Wisconsin back in 2010, you promised that you would create 250,000 jobs in your first term, first four years. In fact, Wisconsin added barely half that and ranked 35th in the country in job growth. Now you’re running for president, and you’re promising an economic plan in which everyone will earn a piece of the American dream."
498,WALLACE,WALLACE,uncategorized,"Given your record in Wisconsin, why should voters believe you?"
499,WALKER,WALKER,uncategorized,"Well, the voters in Wisconsin elected me last year for the third time because they wanted someone who aimed high, not aimed low."
500,WALKER,WALKER,uncategorized,"Before I came in, the unemployment rate was over eight percent. It’s now down to 4.6 percent. We’ve more than made up for the jobs that were lost during the recession. And the rate in which people are working is almost five points higher than it is nationally."
501,WALKER,WALKER,uncategorized,"You know, people like Hillary Clinton think you grow the economy by growing Washington. One report last year showed that six of the top 10 wealthiest counties in America were in or around Washington, D.C.. I think most of us in America understand that people, not the government creates jobs. And one of the best things we can do is get the government out of the way, repeal Obamacare, put in — reign in all the out of control regulations, put in place and all of the above energy policy, give people the education, the skills that the need to succeed, and lower the tax rate and reform the tax code. That’s what I’ll do as president, just like I did in Wisconsin."
502,WALKER,WALKER,uncategorized,(APPLAUSE)
503,WALLACE,WALLACE,uncategorized,"Governor Christie, I want to engage you and Governor Huckabee in a subject that is a big issue in both of your campaigns, and that is entitlement reform."
